,price,address
0,"€238,000 ","35 Charles Daly Road, Togher, Togher (Cork City), Co. Cork"
1,"€197,500 ","18 Fairways, Castlebar, Co. Mayo"
2,"€425,000 ","17 Oakfield Heights, Glanmire, Co. Cork"
3,"€550,000 ","102 Iveragh Road, Whitehall, Whitehall, Dublin 9"
4,"€115,000 ","Parnell Row, Granard, Co. Longford"
5,"€158,500 ","Beech, Turlough, Castlebar, Co. Mayo"
6,"€225,000 ","Polladooey, Aughnacliffe, Co. Longford"
7,"€160,000 ","136 Templeacre Avenue, Gurranebraher, Gurranabraher, Co. Cork"
8,"€475,000 ","15 Baskin Cottages, Cloghran, Co. Dublin"
9,"From €555,000 ","Cherry Lane, Cherry Lane, Cherrywood, Co. Dublin"
10,"€875,000 ","2 Cherry Hill, Delgany Wood, Delgany, Co. Wicklow"
11,"€349,000 ","37 Castleheath, Malahide, Co. Dublin"
12,"€160,000 ","Drumgill, Drumconrath, Co. Meath"
13,"€315,000 ","1 Church View, Ardcath, Garristown, Co. Meath"
14,"€259,000 ","Apartment 13, Moorings, Harty's Quay, Rochestown, Co. Cork"
15,"€195,000 ","63 Cois Na H, Abhainn, Ballygaddy Road, Tuam, Co. Galway"
16,"€238,000 ","Apartment 1E, Gort Siar, Knocknacarra, Co. Galway"
17,"€239,950 ","9 Druim Cala, Dromod, Co. Leitrim"
18,"€210,000 ","24 Dun Na Ri, Tobarteascain, Ennis, Co. Clare"
19,"€139,000 ","15 Carraíg Abháinn, Ballisodare, Co. Sligo"
20,"€565,000 ","Donore House, Turtulla, Thurles, Co. Tipperary"
21,"€575,000 ","Manderley, Muckross Drive, Muckross Road, Killarney, Co. Kerry"
22,"€575,000 ","1 An Tuairin, Lackenfune, Dungarvan, Co. Waterford"
23,"€540,000 ","Apartment 21, Block 5, Galley Quay, Dublin 2"
24,"€795,000 ","Bella Vista, Tomriland, Roundwood, Co. Wicklow"
25,"€520,000 ","13 Rosewood Avenue, Bandon, Co. Cork"
26,"€285,000 ","2 Blakes Court, Clonsilla, Dublin 15"
27,"18 Luxury A rated 3, 4 & 5 Bed Contemporary Homes ","Leighton Manor, Two Mile Borris, Thurles, Twomileborris, Co. Tipperary"
28,"€395,000 ","Loughnagin Heights, Ramelton Road, Letterkenny, Co. Donegal"
29,"€500,000 ","Rossbrin, Schull, Co. Cork"
30,"€330,000 ","17 Ribh Road, Artane, Artane, Dublin 5"
31,"€185,000 ","7 Kylemore Grove, Fiddown, Co. Kilkenny"
32,"€1,150,000 ","The Inglenook, Co. Cork"
33,"€350,000 ","Toor North, Aglish, Dungarvan, Co. Waterford"
34,"€205,000 ","10 Woodstream, Coolaney, Co. Sligo"
35,"€260,000 ","8 Dun Aras, Hurler's Cross, Shannon, Co. Clare"
36,Price on Application ,"Kilclare House, Conna, Co. Cork"
37,"€230,000 ","3 Close's Park, Farranree, Farranree, Co. Cork"
38,"€410,000 ","42 Old Mill Race, Athgarvan, Newbridge, Co. Kildare"
39,"€470,000 ","15 Rowan Hall, Milltown, Dublin 6"
40,Price on Application ,"Oak Church, Oak Church, Kildare, Co. Kildare"
41,"€425,000 ","""Lisieux"", Greenville Close, Enniscorthy, Co. Wexford"
42,"€190,000 ","190 Rusheen Árd, Caltragh, Sligo, Co. Sligo"
43,"€495,000 ","496 Collins Avenue, Whitehall, Dublin 9"
44,"€650,000 ","Dromena Hill, Castlebellingham, Dundalk, Co. Louth"
45,Price on Application ,"Cregnanagh, Shrule, Shrule, Co. Mayo"
46,"€550,000 ","20 Killeen Avenue, Malahide, Co. Dublin"
47,"€240,000 ","18 Broomville Close, Portlaoise, Co. Laois"
48,"€120,000 ","Drumhaldry, Moyne, Co. Longford"
49,"€375,000 ","101 The Clayton, The Gasworks, South Lotts Road, Ringsend, Dublin 4"
50,"€149,000 ","Apartment 13, Block A, The Oaks, Portarlington, Co. Laois"
51,"€1,225,000 ","10 The Crescent, Co. Galway"
52,"€165,000 ","4 Railway Mews, Bruree, Co. Limerick"
53,"€750,000 ","Stradbally East, Clarinbridge, Co. Galway"
54,"€490,000 ","Garrymore, Portarlington, Co. Laois"
55,"From €224,950 ","Dundoogan, Haynestown, Dundalk, Co. Louth"
56,"€100,000 ","Racecourse Road, Dowdallshill, Dowdallshill, Co. Louth"
57,"€295,000 ","Apartment 7, Fairhaven, Malahide, Co. Dublin"
58,"€525,000 ","8 Ardilea, Castlecomer Road, Kilkenny, Co. Kilkenny"
59,"€495,000 ","The Boreen, Bishopstown, Rosemount, Moate, Co. Westmeath"
60,"€370,000 ","32 Knockmaree, Chapelizod, Chapelizod, Dublin 20"
61,"€740,000 ","60 Leinster Park, Harold's Cross Road, Harold's Cross, Dublin 6"
62,"€400,000 ","75 The Lawn, Coolroe Meadows, Ballincollig, Co. Cork"
63,"€525,000 ","Whitethorn, Clonmore, Kildalkey, Co. Meath"
64,"€275,000 ","Charleville Road, Tullamore, Co. Offaly"
65,"€395,000 ","3 Allen Terrace, Phibsborough, Dublin 7"
66,"€165,000 ","Apartment 12, Atlantic Coast, Tramore, Co. Waterford"
67,"€295,000 ","48 Willow Wood Grove, Hartstown, Hartstown, Dublin 15"
68,"€795,000 ","TRUMP INTERNATIONAL GOLF LINKS LIMITED, Trump International Golf Links & Hotel, Doonbeg, Co. Clare"
69,"€385,000 ","149 Millrace Road, Castleknock, Dublin 15"
70,"€445,000 ","10 Tournore Park, Abbeyside, Dungarvan, Co. Waterford"
71,"€359,000 ","15 The Park, Sligo, Co. Sligo"
72,"€410,000 ","30 Glen Ellen Gardens, Swords, Co. Dublin"
73,"€450,000 ","24 Kilvere Park, Cypress Downs, Templeogue, Dublin 6W"
74,"€350,000 ","Bilboa, Cappamore, Co. Limerick"
75,"€500,000 ","Beary's Cross, Boher, Co. Limerick"
76,"€355,000 ","Coole, Ballyragget, Co. Kilkenny"
77,"From €725,000 ","One to Nine Priory, Delgany, Co. Wicklow"
78,"€360,000 ","8 Newtown Woods, Newtown Road, Co. Waterford"
79,"€680,000 ","Clowney, Ballyconnell, Co. Cavan"
80,"€849,000 ","1 Waterfall Avenue, Richmond Road, Dublin 3"
81,"€285,000 ","Apartment 12, Dorset Square, Dublin 1"
82,"€1,450,000 ","ATLANTIC PROJECTS COMPANY LIMITED, 3 Marine Road, Dun Laoghaire, Co. Dublin"
83,"€310,000 ","3 Orchardstown Close, Butlerstown, Co. Waterford"
84,"€410,000 ","Willow House, Barnakyle, Patrickswell, Co. Limerick"
85,"€465,000 ","45 Cairnbrook Avenue, Carrickmines, Dublin 18"
86,"€1,650,000 ","Glenealy House, Glenealy, Co. Wicklow"
87,"€430,000 ","16 Silverpines, Killarney Park, Bray, Co. Wicklow"
88,"€299,750 ","86 Lakeview, Rathbawn Road, Castlebar, Co. Mayo"
89,"€1,450,000 ","Ardbeg, Model Farm Road, Co. Cork"
90,"€295,000 ","12 Sundays Well Road, Co. Cork"
91,"€275,000 ","8 Pembroke Close East, Passage West, Cork, Rochestown, Co. Cork"
92,"€325,000 ","Casa Jude, 6 Millfield Lawn, Dublin Hill, Blackpool, Co. Cork"
93,"€330,000 ","21 Supple Park, Dunshaughlin, Co. Meath"
94,"€250,000 ","6 Water Street, Youghal, Co. Cork"
95,"€345,000 ","34 Castletimon Avenue, Coolock, Kilmore, Dublin 5"
96,"€390,000 ","Cokery House, Cavansheath, Ballyfin, Co. Laois"
97,"€450,000 ","16 Faulkners Terrace, Kilmainham, Dublin 8"
98,"€350,000 ","Prague Ville, 7 Beechwood Drive, Ballinlough, Co. Cork"
99,"€575,000 ","Rushworth, Muckross Road, Killarney, Co. Kerry"
100,"€550,000 ","Apartment 37, Forbes Quay Apartments, Grand Canal Dock, Dublin 2"
101,"€495,000 ","Tobercrossaun, Headford, Co. Galway"
102,"€1,395,000 ","Laurel House, 122, Ranelagh, Dublin 6"
103,"€620,000 ","Devon View House, Pearse Square, Youghal, Co. Cork"
104,"€395,000 ","The Haven, Carrowbaun, Westport, Co. Mayo"
105,"€560,000 ","The Old Post Office, Post Office Road, Lusk, Co. Dublin"
106,"€395,000 ","Wellfield, Mountrath Road, Portlaoise, Co. Laois"
107,"€229,000 ","Rose Cottage, Mountarmstrong, Donadea, Co. Kildare"
108,"€550,000 ","32 Beverly Crescent, Knocklyon, Dublin 16"
109,"€4,750,000 ","Tresillian House, Brighton Road, Foxrock, Dublin 18"
110,Price on Application ,"Bellingsfield , Pipers Hill, Naas, Co. Kildare"
111,Price on Application ,"Bellingsfield , Pipers Hill, Naas, Co. Kildare"
112,Launching soon- register your interest today! Stunning 3 & 4 bedroom homes in a great location ,"Domville, Cherrywood, Co. Dublin"
113,"€750,000 ","Gentle House, Knockanree, Avoca, Co. Wicklow"
114,"€395,000 ","Avalon House, Avalon House, 13 Moylena, Tullamore, Co. Offaly"
115,"€290,000 ","146 An Fiodan, Doughiska, Co. Galway"
116,"€445,000 ","Setting Sun, Ballyhack Lower, Arthurstown, Co. Wexford"
117,"€125,000 ","Ratra, Tibohine, Tibohine, Co. Roscommon"
118,"€430,000 ","46 Saint Brigid's Park, Foxrock, Foxrock, Dublin 18"
119,Price on Application ,"Coil Coille, 80 Slieve Rua Drive, Stillorgan, Co. Dublin"
120,"€279,000 ","20 Rosewood Rise, Ballylangley, Bandon, Co. Cork"
121,"€199,000 ","5 Castlequarter Heights, Fedamore, Co. Limerick"
122,"€200,000 ","35 Garden View, Creggaunahilla, Ennis, Co. Clare"
123,"€945,000 ","3 Merton Walk, Mount St Annes, Milltown, Dublin 6"
124,"€449,500 ","16 Knockaderry, Liscannor, Co. Clare"
125,"€279,000 ","28 Westfields, Clare Road, Ennis, Co. Clare"
126,"€395,000 ","2 Eastmore, Bushy Park Road, Terenure, Dublin 6"
127,"€300,000 ","Seefin, Church Road, Durrus, Co. Cork"
128,"€1,295,000 ","Carrigfoyle, 13 Maryborough Orchard, Maryborough Hill, Douglas, Co. Cork"
129,"€265,000 ","35 Kilkee House, Clare Village, Clarehall, Dublin 13"
130,"€350,000 ","Heatherbank, Oulart Village, Oulart, Co. Wexford"
131,"€495,000 ","Apartment 14, Block 1, Clearwater Cove, Dun Laoghaire, Co. Dublin"
132,"€199,999 ","22 Lime Tree Avenue, Portlaoise, Co. Laois"
133,"€165,000 ","381 The Sycamores, Kilnacourt Woods, Portarlington, Co. Laois"
134,"€315,000 ","26 The Lawn, Coolroe Meadows, Ballincollig, Co. Cork"
135,Come Home to Exceptional Living  ,"Donacarney Wood, Mornington, Co. Meath"
136,"€269,000 ","23 Iniscarrigh, Saint Flannans Drive, Ennis, Co. Clare"
137,Home at last… ,"Oak Church, Kildare, Co. Kildare"
138,"€229,000 ","19 Beechwood, Clarecastle, Co. Clare"
139,"€3,800,000 ","78 Merrion Road, Ballsbridge, Dublin 4"
140,"€395,000 ","Cedar Lodge, Ballincar, Rosses Point, Co. Sligo"
141,"€525,000 ","23 Fontenoy Street, Phibsborough, Dublin 7"
142,London's Finest Developers In Portlaoise's Finest Address. PHASE TWO ALMOST SOLD OUT ,"Foxburrow, Stradbally Road Portlaoise, Portlaoise, Co. Laois"
143,Extremely Spacious & Prestigious Homes ,"Holdbrook, Dublin Road, Portlaoise, Portlaoise, Co. Laois"
144,"€750,000 ","132 Botanic Avenue, Glasnevin, Dublin 9"
145,"€497,000 ","157 Esker Lawns, Lucan, Co. Dublin"
146,"€255,000 ","10 Evergreen Street, Co. Cork"
147,"€375,000 ","25 Forest Green, Swords, Co. Dublin"
148,"€165,000 ","12 Abhann Dubh, Patrick Street, Portarlington, Co. Laois"
149,"€825,000 ","Clifford House, Ballinlough Road, Ballinlough, Co. Cork"
150,"€245,000 ","94 Eallagh, Headford, Co. Galway"
151,"€325,000 ","43 Rosehaven, Castleknock, Dublin 15"
152,Price on Application ,"Station Walk, Newbridge, Co. Kildare"
153,Price on Application ,"Station Walk, Newbridge, Co. Kildare"
154,"€185,000 ","32 Radharc An Bhaile, Bandon, Co. Cork"
155,"€375,000 ","51 Hazelbury Green, Clonee, Dublin 15"
156,"€185,000 ","2 Old Wood, Cliffoney, Co. Sligo"
157,"€305,000 ","Redtops, Dunmanway Road, Bandon, Co. Cork"
158,"€395,000 ","Apartment 17, Chamberlain Court, 11/13 Richmond Avenue, Dublin 3"
159,"€295,000 ","1 Beechmount Grove, Navan, Co. Meath"
160,"€3,000,000 ","11 Raglan Road, Ballsbridge, Dublin 4"
161,"€590,000 ","12 Auburn Drive, Castleknock, Castleknock, Dublin 15"
162,Come home to natural beauty. ,"Vartry Wood, Ashford, Co. Wicklow"
163,"€120,000 ","78 Rahoonane, Monavalley, Tralee, Co. Kerry"
164,"€235,000 ","23 Radharc Na Mara, Coolcotts, Wexford Town, Co. Wexford"
165,"€195,000 ","2 Ardnacassa Manor, Longford Town, Co. Longford"
166,"""A"" RATED HOMES IN A SUPERB LOCATION ","'Janeville' , Carrigaline, Co. Cork"
167,"€545,000 ","188 Beech Park, Lucan, Co. Dublin"
168,"€1,950,000 ","Villa Vico, Sorrento Road, Dalkey, Co. Dublin"
169,"AMV: €380,000 ","10 Thornville Avenue, Kilbarrack, Dublin 5"
170,"AMV: €425,000 ","21 Deepdales, Southern Cross Road, Bray, Co. Wicklow"
171,"AMV: €620,000 ","11 & 12 Wilson Terrace, Hanbury Lane, Dublin 8"
172,"AMV: €725,000 ","Carn, 31 Barnhill Road, Dalkey, Co. Dublin"
173,"€189,500 ","79 Chestnut Grove, Castlebar, Co. Mayo"
174,"€775,000 ","Greenwood Cottage, Greenwood, Kinsealy, Co. Dublin"
175,"€285,000 ","50 Poplar Drive, Carraig An Aird, Six Cross Roads, Waterford, Co. Waterford"
176,Price on Application ,"'Woodbine Lodge', Woodbine Road, Booterstown, Co. Dublin"
177,Price on Application ,"Seamount Rise, Malahide, Co. Dublin"
178,"€145,000 ","Bayview, Ballisodare, Co. Sligo"
179,"€240,000 ","Claragh Irish, Lavagh, Ballymote, Co. Sligo"
180,"€435,000 ","17 Dunbur Park, Wicklow Town, Co. Wicklow"
181,"€395,000 ","18 Honeywell, Toberteascáin, Ennis, Co. Clare"
182,"€360,000 ","11 Reilly's Avenue, Cork Street, Dolphin's Barn, Dublin 8"
183,"€220,000 ","8 Millbrook Apartments, Millbrook, Navan, Co. Meath"
184,"€249,000 ","Patrick Street, Portarlington, Co. Laois"
185,"€185,000 ","9 Priest's Lane, Drogheda, Co. Louth"
186,"€320,000 ","101 The Rectory, Enniskerry Road, Stepaside, Dublin 18"
187,"€450,000 ","Longshore Cottage, Burrow Road, Portrane, Co. Dublin"
188,Price on Application ,"Ledwill Park, Ledwill Park, Kilcock, Co. Kildare"
189,"€350,000 ","Church Cross, Skibbereen, Co. Cork"
190,"€395,000 ","39 Aughrim Hall, Aughrim, Co. Wicklow"
191,"€565,000 ","Clovelly, Castletown, Tramore, Co. Waterford"
192,"€235,000 ","72 Orrery Road, Gurranebraher, Gurranabraher, Co. Cork"
193,"€550,000 ","Maple Run, Old Johnstown, Navan, Co. Meath"
194,"€250,000 ","15 Elm Park House, Grange Wood, Rathfarnham, Dublin 16"
195,"From €495,000 ","New Build, Ahiohill, Clonakilty, Co. Cork"
196,"€295,000 ","Apartment 169, The Gallery, Donabate, Co. Dublin"
197,"AMV: €220,000 ","3 Hynes Yard, Merchants Road, Co. Galway"
198,"€395,000 ","11 Ros Na Rí, Shanaway Road, Ennis, Co. Clare"
199,"€550,000 ","Sheane House, Irishtown, Mountmellick, Co. Laois"
200,"€199,500 ","Westview, 1 Viewpoint, Pound Road, Castlebar, Co. Mayo"
201,"€199,950 ","9 Harmony Heights, Castlebar, Co. Mayo"
202,"€185,000 ","Chapel Street, Kiltimagh, Co. Mayo"
203,"€335,000 ","Graigue Cottage, Forest Road, Carrigaline, Co. Cork"
204,"€695,000 ","Apartment 21, Block H, Hanover Quarter, Dublin 2"
205,"€135,000 ","Apartment 19, Bowers View, Ballinrobe, Co. Mayo"
206,"€215,000 ","17 The Concert Building, Park West, Dublin 12"
207,"€740,000 ","30 Talbot Court, Castleknock, Dublin 15"
208,Final 2 Bedroom Homes Available ,"Marina Village Apartments, Marina Village Apartments, Greystones, Co. Wicklow"
209,New Phase Coming Soon ,"Silver Banks, Stamullen, Co. Meath"
210,New Development Coming Soon ,"Belin Woods, Athgarvan Road, Kilbelin, Newbridge, Co. Kildare"
211,New Development Coming Soon ,"Ravens Mill, Rolestown, Rolestown, Co. Dublin"
212,New Development Coming Soon ,"Riversend, Effernock, Trim, Co. Meath"
213,New Development Coming Soon - Register for further Information ,"Castleland Park, Balbriggan, Co. Dublin"
214,* New release of 3 & 4 bedroom Semi-Detached + Final 4 Bed Detached just released overlooking the ca ,"Ledwill Park, Ledwill Park, Kilcock, Co. Kildare"
215,Final 3 and 4 Bedroom Homes ,"Barnhall Meadows, Leixlip, Co. Kildare"
216,Final 3 and 4 Bedroom Homes ,"Barnhall Meadows, Leixlip, Co. Kildare"
217,"All Units Currently Sale Agreed, Register for Cancellations ","Oldbridge Manor, Drogheda, Co. Meath"
218,Final Remaining 3 Bedroom Bungalow Available ,"Ruxton Oaks, Blackcastle, Navan, Co. Meath"
219,"3 Bedroom Homes Available from €250,000 ","The Hawthorns , Arden Road, Tullamore, Co. Offaly"
220,New Development Coming Soon ,"Walker's Gate, Kildare, Co. Kildare"
221,"€199,000 ","373 The Sycamores, Kilnacourt Woods, Portarlington, Co. Laois"
222,Price on Application ,"Fuchsia Hill, Courtmacsherry, Co. Cork"
223,"€785,000 ","Cragmoher House, Cragmoher, Corofin, Ennis, Co. Clare"
224,"€295,000 ","84 Meadow View, Drogheda, Co. Louth"
225,"€350,000 ","26 Upper Beaumont Drive, Ballintemple, Ballintemple, Co. Cork"
226,"€275,000 ","10 Corr Na Meala, Birr, Co. Offaly"
227,"€315,000 ","John's Terrace, Birr, Co. Offaly"
228,"€725,000 ","6A Woodbine Road, Booterstown, Co. Dublin"
229,"€285,000 ","25 Woodhaven, Kilrush Road, Ennis, Co. Clare"
230,Price on Application ,"Seamount Rise, Malahide, Co. Dublin"
231,"€259,000 ","Cluainbán, 91 Abbey Court, Clare Road, Ennis, Co. Clare"
232,Price on Application ,"24 Grenville, Dublin Road, Portlaoise, Co. Laois"
233,"€385,000 ","2 Abbeyvale Court, Swords, Co. Dublin"
234,"€195,000 ","3C Haydens Lane, Main Street, Kinsale, Co. Cork"
235,"€295,000 ","""Rocketts of the Metalman"", Westtown, Tramore, Co. Waterford"
236,"€425,000 ","14 Saint Christophers Walk, Montenotte, Co. Cork"
237,"€245,000 ","20 Meadowvale, Coolcotts, Wexford Town, Co. Wexford"
238,"€865,000 ","70 St Alban's Park, Sandymount, Dublin 4"
239,"€450,000 ","Hillside, 12 Ballinahinch Terrace, Ashford, Co. Wicklow"
240,"€325,000 ","Liskeveen, Littleton, Thurles, Co. Tipperary"
241,"€549,000 ","Rathpatrick, Slieverue, Co. Kilkenny"
242,"€290,000 ","58 Sandygrove, Blackrock, Co. Louth"
243,"€595,000 ","Rere of 3, Charlemont Terrace, Dun Laoghaire, Co. Dublin"
244,"€395,000 ","Killoughter, Redhills, Co. Cavan"
245,"€335,000 ","24 Clochog, Oranmore, Co. Galway"
246,"€410,000 ","96 The Green, Coolroe Meadows, Ballincollig, Co. Cork"
247,"€330,000 ","27 Ros Mé­n, Tullyvarraga, Shannon, Co. Clare"
248,"€685,000 ","39 Grattan Park, Salthill, Co. Galway"
249,"€495,000 ","22 Main Road, Tallaght, Tallaght, Dublin 24"
250,"€720,000 ","169 Seapark, Malahide, Co. Dublin"
251,"€185,000 ","4 Saint Joseph's Avenue, Boyle, Co. Roscommon"
252,"€750,000 ","90 Castleknock Park, Castleknock, Dublin 15"
253,"4 Bedroom Homes, 2 Bedroom Apartments & Penthouses Launching in September ","Trimbleston, Trimbleston, Goatstown, Dublin 14"
254,"€390,000 ","Killaghy Street, Mullinahone, Co. Tipperary"
255,"€395,000 ","3 Millbrook, Rathmullan, Co. Donegal"
256,"€500,000 ","Moymore House, Moymore, Pallasgreen, Co. Limerick"
257,"Churchlands, Delgany, Co. Wicklow ","Churchlands, Churchlands, Delgany, Co. Wicklow"
258,"€400,000 ","Sandville House, Aghavoher, Ballyconnell, Co. Cavan"
259,"€325,000 ","Three Chimneys, Creamery Road, Piltown, Co. Kilkenny"
260,"€1,450,000 ","Yellowood, 18A Stillorgan Park Avenue, Blackrock, Co. Dublin"
261,"€1,150,000 ","Penthouse 72, Woodview, Blackrock, Co. Dublin"
262,"€495,000 ","An Cnocán, Ballyoshea, Kildimo, Co. Limerick"
263,Price on Application ,"Mercer Vale, Cherrywood, Co. Dublin"
264,"€379,000 ","8 Inis Órga, Curryclogh, Bandon, Co. Cork"
265,"€395,000 ","13 Pembroke Cottages, Dundrum, Dundrum, Dublin 14"
266,Price on Application ,"Ballinascorney, Brittas, Co. Dublin"
267,"€575,000 ","Castletown Manor, Cottlestown, Sligo, Co. Sligo"
268,"€225,000 ","14 Riverside, Portarlington, Co. Laois"
269,"€299,000 ","48 Gort Na Ri, Ennis, Co. Clare"
270,"From €287,000 ","Aughamore, Clane, Co. Kildare"
271,Price on Application ,"Whitethorn, Naas, Co. Kildare"
272,Price on Application ,"Hawkins Wood, Greystones, Co. Wicklow"
273,"From €825,000 ","Donnybrook Gardens, Dublin 4"
274,"From €300,000 ","Graydon, Newcastle, Co. Dublin"
275,"From €485,000 ","Archers Wood, Delgany, Co. Wicklow"
276,"€1,150,000 ","155 Vernon Avenue, Clontarf, Clontarf, Dublin 3"
277,"€685,000 ","22 The Spires, Donabate, Co. Dublin"
278,"€779,000 ","Drominagh Lodge, Drominagh, Ballinderry, Nenagh, Co. Tipperary"
279,"€185,000 ","Kylemore, Killimor, Co. Galway"
280,"€725,000 ","30 Trimleston Gardens, Booterstown, Co. Dublin"
281,"€349,000 ","Ballylee, Gort, Co. Galway"
282,"€225,000 ","Apartment 60, Mayeston Crescent, Saint Margaret's Road, Finglas, Dublin 11"
283,Price on Application ,"10 Apartments at Corn Mill, Drumcondra, Dublin 3"
284,"€275,000 ","23 Wolfe Tone Street, Kilkenny, Co. Kilkenny"
285,"AMV: €350,000 ","Two Derelict Cottages, Ounavarra, Coldblow, Lucan, Co. Dublin"
286,"€1,035,000 ","2 The Avenue, Cypress Downs, Templeogue, Dublin 6W"
287,"€195,000 ","Main Street, Aughnacliffe, Co. Longford"
288,"€525,000 ","73 Meadowbank, Bushy Park Road, Terenure, Dublin 6"
289,"€625,000 ","Rose Cottage, Rose Cottage, 10 Rochestown Ave, Dun Laoghaire, Co. Dublin"
290,"€425,000 ","22 Upper Glencairn, Riverstown, Glanmire, Co. Cork"
291,"€150,000 ","Apartment 15, Cartron Court, Sligo, Co. Sligo"
292,"€625,000 ","8 Wendell Avenue, Portmarnock, Co. Dublin"
293,"€365,000 ","Apartment 259, Asgard, Custom House Harbour Apartments, Dublin 1"
294,"€650,000 ","6 Foxbrook, Curraha Road, Ratoath, Co. Meath"
295,"€595,000 ","30 Clonliffe Road (plus Attic Conversion), Drumcondra, Dublin 3"
296,"€450,000 ","61 Church Avenue, Drumcondra, Dublin 9"
297,"€350,000 ","Rylinn, Ballintemple, Castlegar, Co. Galway"
298,"€795,000 ","Liwara, Shanganagh Road, Killiney, Co. Dublin"
299,"€600,000 ","Valley View Cottage, Barracurragh, Gorey, Co. Wexford"
300,"€3,750,000 ","Brentwood, Sydenham Road, Dundrum, Dublin 14"
301,"€2,500,000 ","Alma, Park, Wexford Town, Co. Wexford"
302,"€320,000 ","29 An Gleib, Ballivor, Co. Meath"
303,"€295,000 ","St Teresa's, Mail Coach Road, Sligo, Co. Sligo"
304,"€675,000 ","28 Springfield Crescent, Templeogue, Templeogue, Dublin 6W"
305,"€425,000 ","Ballinamore, Kiltimagh, Co. Mayo"
306,"€249,000 ","Miskaun Glebe, Aughnasheelan, Co. Leitrim"
307,Outstanding Living ,"Maydenhayes Cove, Mornington, Co. Meath"
308,"From €345,000 ","Gleann na Mona, Ballymoneen Road , Knocknacarra, Co. Galway"
309,"€220,000 ","The Quay, Thomastown, Co. Kilkenny"
310,"€575,000 ","Ballyvoole, Inistioge, Co. Kilkenny"
311,"€175,000 ","311 Cathedral Road, Gurranabraher, Co. Cork"
312,"€295,000 ","53 Belgard Downs, Rochestown Road, Douglas, Co. Cork"
313,"€310,000 ","9 Ballygarra Park, Garristown, Co. Dublin"
314,"€265,000 ","Saint Martins, Rigsdale, Ballinhassig, Co. Cork"
315,"€389,000 ","13A Auburn Villas, Athlone, Co. Westmeath"
316,"€370,000 ","Lupin Lodge, Drumiskabole, Carraroe, Co. Sligo"
317,"€355,000 ","37 The Heights, Melrose Park, Kinsealy, Co. Dublin"
318,"€650,000 ","Seatown Road, Malahide, Co. Dublin"
319,Price on Application ,"74 Sweetbriar Lawn, Tramore, Co. Waterford"
320,All properties are now sold.  ,"Eaton Way, Eaton Brae, Shankill, Dublin 18"
321,"€500,000 ","Poppy Field, Shelton, Beech Road, Arklow, Co. Wicklow"
322,"€295,000 ","Hillview House, Curry, Strokestown, Co. Roscommon"
323,"€370,000 ","1 Janemount Park, Corbally, Corbally, Co. Limerick"
324,"Luxury Development of 2,3 & 4 Bed A Rated Homes ","CAIRNHILL MEADOWS, Naas Road, Kilcullen, Co. Kildare"
325,"€500,000 ","1 Tullyglass Hill, Shannon, Co. Clare"
326,"€400,000 ","Sleepy Hollow, Wood Road, Cratloe, Co. Clare"
327,"€345,000 ","30 Fernwood, Glanmire, Glanmire, Co. Cork"
328,"€220,000 ","22 The Cricket Fields, Dunmore Road, Tuam, Co. Galway"
329,"€489,000 ","""Rose Haven"", Creggan, Athlone, Co. Westmeath"
330,"€500,000 ","Ballykilleen, Edenderry, Co. Offaly"
331,"€280,000 ","32 Old Galway Road, Loughrea, Co. Galway"
332,"€335,000 ","Cahercrea East, Loughrea, Co. Galway"
333,"€660,000 ","9 Bluebells Grove, Killarney, Co. Kerry"
334,"€160,000 ","Kilquane, Headford, Killarney, Co. Kerry"
335,"€325,000 ","40 Tournore Court, Dungarvan, Co. Waterford"
336,"€495,000 ","Kevin Villa, 3 Mount Vincent View, Co. Limerick"
337,"€295,000 ","3 Northbrook Terrace, North Strand, North Strand, Dublin 3"
338,"€420,000 ","Woodleigh, Ballyfoyle, Co. Kilkenny"
339,Price on Application ,"Emmet House, Birr, Co. Offaly"
340,"€499,000 ","Riverside, Rathnew, Co. Wicklow"
341,"€347,500 ","12 Rialto Street, Rialto, Dublin 8"
342,"€180,000 ","4 Rockview, Legan, Co. Longford"
343,"€375,000 ","2 Latchford Park, Clonee, Dublin 15"
344,"€455,000 ","1 Parkside, Ballymore Eustace Road, Naas, Co. Kildare"
345,"€135,000 ","128 Saint Michael's Avenue, Tipperary Town, Co. Tipperary"
346,"€230,000 ","3 The Old Station House, Trim Road, Athboy, Co. Meath"
347,"€240,000 ","8 Willow Brook, Commons Cross, Dromiskin, Co. Louth"
348,"€695,000 ","Knockarudane, Glandore, Co. Cork"
349,"€130,000 ","Apartment 26, James Gate Apartments, Co. Waterford"
350,"€280,000 ","5 Brockton Drive, Hollybrook, Ferrybank"
351,Price on Application ,"113 Phibsborough Road, Phibsborough, Dublin 7"
352,"€325,000 ","Stonehaven, Ballytoohey, Tarmonbarry, Co. Roscommon"
353,"€135,000 ","1 Longbridge, Dunmanway, Co. Cork"
354,"€299,000 ","Maugh, Dunmanway, Co. Cork"
355,"€750,000 ","Woodsmoke, Castlebernard, Bandon, Co. Cork"
356,"€250,000 ","29 Hunter's Hill, Creagh Demesne, Gorey, Co. Wexford"
357,"€495,000 ","6 South Parade, Co. Waterford"
358,"€495,000 ","4 Gleann Na Riogh Drive, Naas, Co. Kildare"
359,"€329,000 ","Gaulstown, Glenmore, Co. Kilkenny"
360,"€465,000 ","5 Manor Avenue, Maryborough Ridge, Douglas, Co. Cork"
361,"€510,000 ","Crosshaven Lodge, 9 Carrigaline Road, Crosshaven, Co. Cork"
362,"€190,000 ","5 Hopkins Mews, Monasterevin, Co. Kildare"
363,"€265,000 ","16 Langton Park, Newbridge, Co. Kildare"
364,"€450,000 ","18 Wyndgates, Maryborough Ridge, Douglas, Co. Cork"
365,"€1,695,000 ","77 Ranelagh Road, Ranelagh, Dublin 6"
366,"€635,000 ","11 Ramleh Hall, Mount St Annes, Milltown, Dublin 6"
367,"€350,000 ","33 Gort Gréine, Rahoon, Rahoon, Co. Galway"
368,"€205,000 ","66 Ashbrook, Enniscorthy, Co. Wexford"
369,"€175,000 ","88 Cluain Bui, Eniscorthy, Enniscorthy, Co. Wexford"
370,"€245,000 ","8 Ballykeeffe Estate, Dooradoyle, Dooradoyle, Co. Limerick"
371,"€180,000 ","118 Kilbarry Place, Farranree, Farranree, Co. Cork"
372,"€220,000 ","25 Gleann Daire, Lyre, Banteer, Co. Cork"
373,"€695,000 ","1 Gulladoo Village, Carrigallen, Co. Leitrim"
374,"€275,000 ","9 Cairlinn, Ghan Road, Carlingford, Co. Louth"
375,"€150,000 ","12 Boyle O'Reilly Terrace, Dundalk, Co. Louth"
376,Price on Application ,"Castlegoland House, Castlegoland, Portnoo, Co. Donegal"
377,Price on Application ,"Danby House, Rossnowlagh Road, Ballyshannon, Co. Donegal"
378,Price on Application ,"PORTLICK INN, Killeenmore, Glasson, Co. Westmeath"
379,"€275,000 ","Drumgola, Cavan, Co. Cavan"
380,"€525,000 ","35 Merrion Strand, Sandymount, Dublin 4"
