,price,address
11025,"€75,000 ","Sráid Sheáin Mhic Dhiarmada, Manorhamilton, Co. Leitrim"
11026,"€75,000 ","Sráid Sheáin Mhic Dhiarmada, Manorhamilton, Co. Leitrim"
11027,"€295,000 ","Faunkill, Eyeries, Co. Cork"
11028,"€199,000 ","Leitrim Road, Carrick-on-Shannon, Co. Leitrim"
11029,"€319,000 ","Leitrim Road, Carrick-on-Shannon, Co. Leitrim"
11030,"€240,000 ","Westport Road, Castlebar, Co. Mayo"
11031,"€395,000 ","Caldra House, Caldragh, Carrick-on-Shannon, Co. Leitrim"
11032,"€380,000 ","Cahermoyle, Ardagh, Co. Limerick"
11033,"€175,000 ","Rathcool, Schull, Co. Cork"
11034,"€475,000 ","Stadalt, Stamullen, Co. Meath"
11035,"€275,000 ","13 High Street, Stradbally, Co. Waterford"
11036,"€685,000 ","10 Inishkeen, Kilcoole, Co. Wicklow"
11037,"€675,000 ","Letter, Schull, Co. Cork"
11038,"€225,000 ","24 Cedar Grove, Carndonagh, Co. Donegal"
11039,"€1,250,000 ","The Coach House, Kilgarron, Enniskerry, Co. Wicklow"
11040,"€600,000 ","The Grove, Harristown, Dunmore East, Co. Waterford"
11041,"€585,000 ","Cahernaglass, Monivea, Co. Galway"
11042,"€265,000 ","57 Oakleigh, Balreask Old, Navan, Co. Meath"
11043,"€105,000 ","Ballyveelick, Castletownroche, Co. Cork"
11044,"€179,500 ","Ballintotis, Midleton, Co. Cork"
11045,"€295,000 ","3 Worlds End, Kinsale, Co. Cork"
11046,"€320,000 ","Kiel, Macroom, Co. Cork"
11047,"€175,000 ","Cloonameeltogue H91KXY4, Shrule, Co. Mayo"
11048,"€50,000 ","Cartymore North, Athenry, Co. Galway"
11049,"€245,000 ","22 Glen Vale, Ballyragget, Co. Kilkenny"
11050,"€130,000 ","Mucklagh, Tullamore, Co. Offaly"
11051,"€300,000 ","Muingaphuca, Caragh Lake, Killorglin, Co. Kerry"
11052,"€65,000 ","Glebe St, Mohill, Co. Leitrim"
11053,"€154,950 ","Slieveowen, Kilmichael, Macroom, Co. Cork"
11054,"€300,000 ","Derrigra, Ballineen, Co. Cork"
11055,"€595,000 ","12 Sandyford Hall Rise Sandyford Dublin 18, Sandyford, Dublin 18"
11056,"€295,000 ","Lismoghry, St. Johnston, Co. Donegal"
11057,"€295,000 ","55 Cashel Avenue, Crumlin, Crumlin, Dublin 12"
11058,"€399,000 ","Fresh Fields, 4 Victoria Terrace, Dundrum, Dublin 14"
11059,"€65,000 ","Coolroe, Tinahely, Co. Wicklow"
11060,"€525,000 ","27 Millmount Grove, Dundrum Road, Dundrum, Dublin 14"
11061,"€670,000 ","Linnanagh, Pond Road, Kilanerin, Gorey, Co. Wexford"
11062,"€244,950 ","397 Cushlawn Park, Tallaght, Dublin 24"
11063,"€290,000 ","4 Parkhill Heights, Kilnamanagh, Dublin 24"
11064,"€240,000 ","12 Cluain Ard, Sea Road, Arklow, Co. Wicklow"
11065,"€650,000 ","Laburnum House, Summerhill, Moville, Co. Donegal"
11066,"€360,000 ","Creggane, Lombardstown, Mallow, Co. Cork"
11067,"€70,000 ","Rathkeery Tiobhine, Frenchpark, Co. Roscommon"
11068,"€180,000 ","BLUEBELL TRADING CO., Mill Street, Tullow, Co. Carlow"
11069,"€230,000 ","4 Eiscir Circle Road, Tullamore, Co. Offaly"
11070,"€275,000 ","House In the Trees, Ballycommane, Durrus, Co. Cork"
11071,"€110,000 ","1 Cul Na Toinne, Magheraclogher, Bunbeg, Co. Donegal"
11072,"€165,000 ","Apartment 15, The Mill Park, Donegal Town, Co. Donegal"
11073,"€250,000 ","Slievegaura, Beaufort, Killarney, Co. Kerry"
11074,Price on Application ,"Rathluby, Kilmurry, Co. Clare"
11075,"€145,000 ","Drim, Lettermore, Co. Galway"
11076,"€230,000 ","26 Stoneleigh, Ballymore, Co. Westmeath"
11077,"€150,000 ","Cloughscoilte, Barna, Co. Galway"
11078,"€299,000 ","Stralongford, Drumkeen, Co. Donegal"
11079,"€75,000 ","Cloonkerry, Barefield, Co. Clare"
11080,"€125,000 ","Ballyboe, Rathmullan, Co. Donegal"
11081,"€200,000 ","12 Chapel Gate, Aylesbury, Tallaght, Dublin 24"
11082,"€3,500,000 ","84 Ailesbury Road Ballsbridge Dublin 4, Ballsbridge, Dublin 4"
11083,"€100,000 ","Bluepool Lower, Kanturk, Co. Cork"
11084,"€350,000 ","Charleville House, Cromane Lower, Killorglin, Co. Kerry"
11085,"€875,000 ","16 Shelbourne Road, Ballsbridge, Ballsbridge, Dublin 4"
11086,Price on Application ,"Carrigeen, Clonoulty, Cashel, Co. Tipperary"
11087,"€2,850,000 ","Headford Cottage, 11 Avoca Avenue, Blackrock, Co. Dublin"
11088,"€100,000 ","Development Site, Tullinadaly Road, Tuam, Co. Galway"
11089,"€660,000 ","40 Ringcurran Rise, Ardbrack, Kinsale, Co. Cork"
11090,"€595,000 ","Bushfield Villa, Bushfield Terrace, Donnybrook, Dublin 4"
11091,"€169,000 ","River Row, Moville, Co. Donegal"
11092,"€300,000 ","Apartment D, 100 Fernleigh Drive, Castleknock, Dublin 15"
11093,"€210,000 ","Corclogh West, Belmullet, Co. Mayo"
11094,"€340,000 ","118 Saint Patrick's Road, Walkinstown, Walkinstown, Dublin 12"
11095,"€170,000 ","Apartment 20, John's Gate, Kilkenny, Co. Kilkenny"
11096,Price on Application ,"Ballygarron, Rathowen, Co. Westmeath"
11097,Price on Application ,"Cullaboy, Granard, Co. Longford"
11098,"€125,000 ","22 Springfield Orchard, Ennis, Co. Clare"
11099,"€155,000 ","43 Ayrhill Court, Roscrea, Co. Tipperary"
11100,"€720,000 ","The White House, Main Street, Castletownshend, Co. Cork"
11101,"€275,000 ","4 Thornhill, Clonakilty, Co. Cork"
11102,"€70,000 ","Tullybradan, Mohill, Co. Leitrim"
11103,"€998,950 ","Pollardstown House & Stud, Pollardstown, The Curragh, Co. Kildare"
11104,"€650,000 ","Dromena Hill, Castlebellingham, Co. Louth"
11105,"€825,000 ","Hilton, Model Farm Road, Model Farm Road, Co. Cork"
11106,"€30,000 ","Loughview, Curnalee, Curraghboy, Co. Roscommon"
11107,"€60,000 ","Loughview, Curnalee, Coolagarry, Co. Roscommon"
11108,"€80,000 ","0.3Acres (Zoned Residential Site), Dunhill, Co. Waterford"
11109,"€650,000 ","Carpathia, Kilmolin, Enniskerry, Co. Wicklow"
11110,"€195,000 ","12 Cois Abhann, Caherweesheen, Tralee, Co. Kerry"
11111,"€110,000 ","Killarney Road, Abbeyfeale, Co. Limerick"
11112,"€255,000 ","Coolcran, Crossmolina Road, Ballina, Co. Mayo"
11113,"€190,000 ","Browneshill Woods, Browneshill Rd. Carlow Town, Carlow Town, Co. Carlow"
11114,"€285,000 ","42 Churchwell Drive, Belmayne, Balgriffin, Dublin 13"
11115,"€295,000 ","Caheralton, Castlemartyr, Midleton, Co. Cork"
11116,"€550,000 ","Parkmore, Roundwood, Co. Wicklow"
11117,"€89,000 ","29 Cluain Ard, Ardnacassa, Longford"
11118,"€8,900,000 ","Summerhill Marino Avenue West Killiney, Killiney, Co. Dublin"
11119,"€200,000 ","Cornamahan, Blacklion, Co. Cavan"
11120,"€95,000 ","12 Drumcarbit Mews, Malin, Co. Donegal"
11121,Price on Application ,"Woolworth's Lane, Co. Limerick"
11122,Price on Application ,"Raven Hill, Baunacloka, Mungret, Co. Limerick"
11123,Price on Application ,"Millview Road, Kanturk, Co. Cork"
11124,"€895,000 ","110 Salthill Apartments, Monkstown, Co. Dublin"
11125,Price on Application ,"1 Saint Joseph's Terrace, Saint Joseph Street, Co. Limerick"
11126,"€235,000 ","22 Corrach Buí, Rahoon, Co. Galway"
11127,"€159,000 ","Clooncool, O'Callaghans Mills, Co. Clare"
11128,"€695,000 ","White House, Leemount, Co. Cork"
11129,"€49,000 ","Site at Lartigue Drive, Derra East, Listowel, Co. Kerry"
11130,Price on Application ,"Main Street, Liscannor, Co. Clare"
11131,"€279,950 ","Kilnagross, Carrick-on-Shannon, Co. Leitrim"
11132,"€595,000 ","145 Philipsburgh Avenue, Fairview, Fairview, Dublin 3"
11133,"€425,000 ","Newpark, Sixmilebridge, Co. Clare"
11134,"€650,000 ","Loughview, Curnalee, Curraghboy, Co. Roscommon"
11135,"€950,000 ","170 Rathmines Road Lower, Rathmines, Dublin 6"
11136,"€400,000 ","New Line, Ardmore, Co. Waterford"
11137,"€295,000 ","6 Mount Bellew Way, Lucan, Co. Dublin"
11138,"€30,000 ","Ballynahattina, Mountbellew, Co. Galway"
11139,"€50,000 ","Gouganes, Banteer, Co. Cork"
11140,"€255,000 ","Mountfin, Ballycarney, Enniscorthy, Co. Wexford"
11141,"€235,000 ","Drummeel, Ballinalee, Co. Longford"
11142,"€149,000 ","Apartment 11, Woodlands View, Navan, Co. Meath"
11143,"€140,000 ","25 Bracklin Park, Edgeworthstown, Co. Longford"
11144,"€170,000 ","22 Cedarville, Abbeyfeale, Co. Limerick"
11145,"€145,000 ","2 Bridge View, Abbeyfeale, Co. Limerick"
11146,"€385,000 ","Ballyferriter West, Dingle, Co. Kerry"
11147,"€185,000 ","29 Pearse Park, Drogheda, Co. Louth"
11148,"AMV: €165,000 ","Liscahill, Edgeworthstown, Co. Longford"
11149,"€215,000 ","Gortnabrade, Carrigart, Co. Donegal"
11150,Price on Application ,"Breenagh, Letterkenny, Breenagh, Co. Donegal"
11151,"€89,500 ","49 Palace Crescent, Ardnacassa"
11152,"€290,000 ","Flat 1, 6 Mountjoy Square North, Dublin 1"
11153,"€180,000 ","Inchinapough, Brosna, Co. Kerry"
11154,"€165,000 ","Mount st, Claremorris, Co. Mayo"
11155,"€50,000 ","Cahercroobeen, Kilmaine, Co. Mayo"
11156,"€1,200,000 ","Carrigeen, Abbeylands, Kinsale, Co. Cork"
11157,"€345,000 ","49 McGoverns Corner, Cork Street, Dublin 8"
11158,"€295,000 ","Creatland, St. Johnston, Co. Donegal"
11159,"€30,000 ","Trihill, Ballygar, Co. Galway"
11160,"€50,000 ","Corclough West, Belmullet, Co. Mayo"
11161,Price on Application ,"18 Dudley Heights, Glenamaddy, Co. Galway"
11162,"€30,000 ","Feebaghbane, Scotstown, Co. Monaghan"
11163,"€139,950 ","'Mill O' Rags', Ambrosetown, Duncormick, Co. Wexford"
11164,"€240,000 ","Doogary, Kilkelly, Co. Mayo"
11165,Price on Application ,"REFLECTIONS HAIR STUDIO, 19 Dunlo Hill, Ballinasloe, Co. Galway"
11166,"€45,000 ","Mountgarrett, Athenry, Co. Galway"
11167,"€145,000 ","Munny, Gorey, Co. Wexford"
11168,"€45,000 ","Kilgill, Claregalway, Co. Galway"
11169,"€1,200,000 ","Carrigeen Abbeylands, Kinsale, Co. Cork"
11170,"€650,000 ","4 New Brighton Terrace, Parnell Road, Bray, Co. Wicklow"
11171,"€350,000 ","36 The Parade, Bastion Court, Athlone, Co. Westmeath"
11172,"€600,000 ","94 Nephin Road, Navan Road, Navan Road (D7), Dublin 7"
11173,"€1,800,000 ","Hildan Country House, Rolestown, Swords, Co. Dublin"
11174,"€185,000 ","6 Southbrook Apartments, 21/22 South Terrace, Co. Cork"
11175,Price on Application ,"Corduff, Arva, Co. Cavan"
11176,"€180,000 ","41 Melvin Fields, Kinlough, Co. Leitrim"
11177,"€275,000 ","Timolin Road, Ballitore, Co. Kildare"
11178,Price on Application ,"Lisnaboy Cullen, Cullen, Co. Cork"
11179,"€75,000 ","Carraigeen North, Baltinglass, Co. Wicklow"
11180,"€330,000 ","455 Mourne Road, Drimnagh, Dublin 12"
11181,"€130,000 ","Bury Street, Ballina, Co. Mayo"
11182,"€130,000 ","2 Hazelwood, Hazelhill, Ballyhaunis, Co. Mayo"
11183,"€169,950 ","19 Cnoc An Lúir, Drumshanbo, Co. Leitrim"
11184,"€585,000 ","10 Balbriggan Road, Skerries, Co. Dublin"
11185,"€2,500,000 ","Pebble Beach, Upper Curragh, Ardmore, Co. Waterford"
11186,"€175,000 ","Ballyhomin, Askeaton, Co. Limerick"
11187,"€625,000 ","162 Delwood Park, Castleknock, Dublin 15"
11188,"€245,000 ","24 Richmond Wood, Riverstown, Glanmire, Co. Cork"
11189,Price on Application ,"Kippagh, Dunmanway, Co. Cork"
11190,"€179,950 ","3 Ard Na Mara, Rosslare Harbour, Co. Wexford"
11191,"€169,000 ","46 Cartron Bay, Sligo, Co. Sligo"
11192,"€250,000 ","Camroc, 6 Saint Alphonsus Avenue, South Circular Road, Co. Limerick"
11193,"€295,000 ","Apartment 19, Market Square, Dublin 7"
11194,"€95,000 ","Swellan Lower, Cavan, Co. Cavan"
11195,"€40,000 ","Aughavannagh, Aughrim, Co. Wicklow"
11196,"€190,000 ","11 Hopkins Haven, Monasterevin, Co. Kildare"
11197,"€250,000 ","20 Maple Avenue, Castlepark, Mallow, Co. Cork"
11198,"€395,000 ","2 Lima Lawn, Magazine Road, Glasheen, Co. Cork"
11199,"€295,000 ","Glendine, Boyne Road, Navan, Co. Meath"
11200,"€350,000 ","Site No. 58 Castlewoods, Ballinamona, Co. Waterford"
11201,"€1,150,000 ","3 Glenair Manor, Delgany, Co. Wicklow"
11202,"€285,000 ","3 Shankill View, Seapoint Road, Bray, Co. Wicklow"
11203,"€285,000 ","Apartment 5, 7 Anglesea Street, Dublin 2"
11204,"€300,000 ","Donaguile, Castlecomer, Co. Kilkenny"
11205,"€980,000 ","Ballynevin, Mothel, Carrick-on-Suir, Co. Tipperary"
11206,"€184,950 ","Church Cottage, Monageer, Enniscorthy, Co. Wexford"
11207,"€600,000 ","c. 1.4 Acre Site, Glandore, Co. Cork"
11208,"€55,000 ","Doire Fhatharta Mor, Carraroe, Co. Galway"
11209,"€550,000 ","The Thatch Cottage, Derrymihan East, Castletownbere, Co. Cork"
11210,"€299,950 ","33 Brookvale, Lucan, Co. Dublin"
11211,Price on Application ,"Ballyrishteen, Dingle, Co. Kerry"
11212,"€320,000 ","20 Mary Street and Adjoining Development Site, Co. Cork"
11213,"€150,000 ","Site 1 Ballydrislane, Tramore, Co. Waterford"
11214,"€95,000 ","Brenan, Kilmacthomas, Co. Waterford"
11215,"€110,000 ","Site 2 Ballydrislane, Tramore, Co. Waterford"
11216,"€350,000 ","Coolbunia, Faithlegg, Co. Waterford"
11217,"€179,000 ","Killacolla, Glin, Co. Limerick"
11218,"€790,000 ","80 Thomas Street, Dublin 8"
11219,"€1,150,000 ","40 Charleville Square, Rathfarnham, Rathfarnham, Dublin 14"
11220,"€169,500 ","Rathmore, Aughnacliffe, Co. Longford"
11221,"€35,000 ","Dromone, Oldcastle, Co. Meath"
11222,"€240,000 ","Tullylannan, Leitrim, Co. Leitrim"
11223,"€130,000 ","Kilcotty, Enniscorthy, Co. Wexford"
11224,"€254,950 ","9 Kilcarrig Avenue, Jobstown, Dublin 24"
11225,Price on Application ,"Lower Quay Street, Sligo, Co. Sligo"
11226,"€395,000 ","Main Street Carney, Carney, Co. Sligo"
11227,Price on Application ,"Mahe, Strandhill Road, Sligo, Co. Sligo"
11228,Price on Application ,"Barrack Street, Templemore, Co. Tipperary"
11229,"€250,000 ","Bohermore, Cashel, Co. Tipperary"
11230,"€249,000 ","31 Knights Park, Castlebar, Co. Mayo"
11231,"€85,000 ","Curraghgraigue, Ballindaggin, Enniscorthy, Co. Wexford"
11232,"€195,000 ","Church Road, Carndonagh, Co. Donegal"
11233,Price on Application ,"19 Main Street, Cloughjordan, Co. Tipperary"
11234,"€170,000 ","Skycur, Kiltormer, Co. Galway"
11235,"€250,000 ","27 Broadstone Avenue, Dublin 7"
11236,"€4,250,000 ","Glenasmole Lodge, Glenasmole, Co. Dublin"
11237,"€300,000 ","33 Joe Murphy Road, Ballyphehane, Co. Cork"
11238,"€620,000 ","West Awake Carrowbaun, Killaloe, Co. Clare"
11239,"€265,000 ","Cashel House, Ballyraine, Letterkenny, Co. Donegal"
11240,Price on Application ,"Boyhollagh Site 2, Attymass, Co. Mayo"
11241,"€445,000 ","Cnoc an Chairn, Chapel Lane, Dingle, Co. Kerry"
11242,"€60,000 ","Cor na Ron, Inverin, Co. Galway"
11243,"€495,000 ","Meelmane, Courtmacsherry, Co. Cork"
11244,"€40,000 ","1.1 Acre Site Holymount, Peterswell, Co. Galway"
11245,"€29,000 ","Carrowtrasna, Greencastle, Co. Donegal"
11246,"€530,000 ","Cloughoolia, Oatfield, Co. Clare"
11247,"€120,000 ","Figary, Fahan, Co. Donegal"
11248,"€99,000 ","52 Beecher Street, Mallow, Co. Cork"
11249,"€85,000 ","Claremount, Claremorris, Co. Mayo"
11250,"€410,000 ","20 Seaview, Kilcoole, Co. Wicklow"
11251,Price on Application ,"Cloughlea, Sixmilebridge, Co. Clare"
11252,"€95,000 ","5 Cois Abhainn, Crossmolina, Co. Mayo"
11253,"€375,000 ","Glencot, Loretto Avenue, Bray, Co. Wicklow"
11254,"€495,000 ","Derrylough, Tuosist, Kenmare, Co. Kerry"
11255,"€350,000 ","Derryginagh West, Bantry, Co. Cork"
11256,"€235,000 ","Saint Jude, Main Street, Pallaskenry, Co. Limerick"
11257,"€235,000 ","17 Mary Street, Co. Cork"
11258,"€1,450,000 ","50 Brighton Road, Rathgar, Dublin 6"
11259,"€635,000 ","Blackwood, Coill Dubh, Co. Kildare"
11260,"€2,600,000 ","42 Wellington Road, Ballsbridge, Dublin 4"
11261,"€249,000 ","41 Stenson Park, Farranshone, Limerick V94 APY2, Co. Limerick"
11262,"€345,000 ","Clonoon Cottage, Cashleen, Renvyle, Co. Galway"
11263,"€45,000 ","Cloonnacross, Milltown, Co. Galway"
11264,"€340,000 ","Donaghmore, Conahy, Ballyragget, Co. Kilkenny"
11265,"€120,000 ","Roscommon Town, Roscommon Town, Co. Roscommon"
11266,"€450,000 ","Corbally More, Dunmore East, Tramore, Co. Waterford"
11267,"€1,100,000 ","239 Griffith Avenue, Drumcondra, Dublin 9"
11268,"€650,000 ","MULCAHY & ASSOCIATES, Garrettstown, Kinsale, Co. Cork"
11269,"€160,000 ","Moynoe, Scarriff, Co. Clare"
11270,"€90,000 ","Gainstown, Navan, Co. Meath"
11271,Price on Application ,"Kilkenny, Castlebar, Co. Mayo"
11272,"€1,650,000 ","11 Acres Of Development Land, Attireesh, Westport, Co. Mayo"
11273,"€325,000 ","Mews Lane Site, Rear Of 387 Clontarf Road, Clontarf, Dublin 3"
11274,"€100,000 ","Dun na Coille, Sixmilebridge, Co. Clare"
11275,"€525,000 ","18 Dun Ri, Bunratty, Co. Clare"
11276,"€200,000 ","Apartment 45, Station House, New Quarter, Kilkenny, Co. Kilkenny"
11277,"€265,000 ","Feighmean Lower, Valentia Island, Co. Kerry"
11278,"€1,950,000 ","Kilkerry, Dalkey Avenue, Dalkey, Co. Dublin"
11279,"€275,000 ","7 Chapel Gate, Ballyvolane, Ballyvolane, Co. Cork"
11280,"€260,000 ","Ballintrane, Fenagh, Co. Carlow"
11281,"€455,000 ","87 The Maltings, Bray, Co. Wicklow"
11282,"€249,950 ","Factory Road, Derrybeg, Co. Donegal"
11283,"€104,950 ","Dunlewey, Derrybeg, Co. Donegal"
11284,"€349,000 ","Chapel Road, Dungloe, Co. Donegal"
11285,"€39,950 ","Narin, Portnoo, Co. Donegal"
11286,"€25,000 ","Culacrick, Annagry, Co. Donegal"
11287,"€25,000 ","Glenahilt, Burtonport, Co. Donegal"
11288,"€25,000 ","Meenmore, Dungloe, Co. Donegal"
11289,"€199,950 ","Belcruit, Kincasslagh, Co. Donegal"
11290,"€15,000 ","Roshin North, Burtonport, Co. Donegal"
11291,"€25,000 ","Meenmore, Dungloe, Co. Donegal"
11292,"€25,000 ","Meenmore, Dungloe, Co. Donegal"
11293,"€765,000 ","1 Ross Cottages, Malahide, Co. Dublin"
11294,"€305,000 ","84 Cois Sruthain, Croom, Co. Limerick"
11295,"€395,000 ","Condonstown, Midleton, Co. Cork"
11296,"€850,000 ","Verelands, Garden Vale, Athlone, Co. Westmeath"
11297,"€120,000 ","Inchmore Island, Lough Ree, Glasson, Co. Westmeath"
11298,"€195,000 ","Magees, Mountnugent, Co. Cavan"
11299,"€97,000 ","3 Cromwellsfort House, Cromwellsfort, Wexford Town, Co. Wexford"
11300,"€100,000 ","Dooish, Newtown Cunningham, Co. Donegal"
11301,"€179,000 ","Lunniagh, Derrybeg, Co. Donegal"
11302,"€1,975,000 ","2 Fitzwilliam Street Upper South City Centre Dublin 2, Dublin 2"
11303,"€365,000 ","Ashleigh House, Grangemellon, Athy, Co. Kildare"
11304,"€270,000 ","Apartment 225, Gort Na Coiribe, Terryland, Co. Galway"
11305,"€695,000 ","Hillcrest, Knockmaroon Hill, Chapelizod, Dublin 20"
11306,"€895,000 ","2 An Pairc, Wotton, The Ward, The Ward"
11307,"€450,000 ","Cocks Lane, Irishtown, Gormanston, Co. Meath"
11308,"€135,000 ","6 Gortamullen Cottages, Kenmare, Co. Kerry"
11309,"€330,000 ","11 Hillcrest Green, Lucan, Co. Dublin"
11310,"€50,000 ","Cahernablauchy, Ballinrobe, Co. Mayo"
11311,"€185,000 ","LITTLE SMILES, Coole, Co. Westmeath"
11312,Price on Application ,"Cloughbrack upper, Clonbur, Co. Galway"
11313,"€250,000 ","Cargaghmore & Ardragh, Corduff, Carrickmacross, Co. Monaghan"
11314,"€275,000 ","John St, Cashel, Co. Tipperary"
11315,"€365,000 ","Eneghan, Walsh Island, Co. Offaly"
11316,"€150,000 ","Drummanbane, New Inn, Co. Cavan"
11317,"€29,950 ","Oughtmeen, Dungloe, Co. Donegal"
11318,"€237,500 ","2 Castle Oaks, Bandon, Co. Cork"
11319,"€310,000 ","School Cross, Lislevane, Bandon, Co. Cork"
11320,"€550,000 ","Old Lighthouse, Inis Mór, Aran Islands, Co. Galway"
11321,"€70,000 ","Caladh Thadhg, Carraroe, Co. Galway"
11322,Price on Application ,"Atlantic Stores, Café & Filling Station, Ballyliffin, Co. Donegal"
11323,"€365,000 ","9 Glebe Crescent, Letterkenny, Co. Donegal"
11324,"€495,000 ","36 Merrion Court, Ailesbury Road, Ballsbridge, Dublin 4"
11325,"€250,000 ","Mount Pleasant, Cadamstown, Broadford, Co. Kildare"
11326,"€100,000 ","Site at Camp Street, Oughterard, Co. Galway"
11327,"€295,000 ","Elm Park, Birr, Co. Offaly"
11328,"€105,000 ","Ballyfoleen South, Kilfinny, Adare, Kilfinny, Co. Limerick"
11329,"€300,000 ","15 Brookhaven Lawn, Blanchardstown, Dublin 15"
11330,"€250,000 ","The Lodge, Cartown, Termonfeckin, Co. Louth"
11331,"€41,000 ","Cottage & 1.3 Acres, Ballyhahill, Co. Limerick"
11332,"€235,000 ","70 Abbeygrove, Navan, Co. Meath"
11333,"€995,000 ","Hillery Cade, Coolcotts Lane, Wexford Town, Co. Wexford"
11334,"€725,000 ","Val Halla, Margaretstown, Skerries, Co. Dublin"
11335,"€2,000,000 ","Derrybeag, 35A Coliemore Road, Dalkey, Co. Dublin"
11336,"€420,000 ","Hall Demesne, Mountcharles, Co. Donegal"
11337,"€339,000 ","7 Hardy's Lane, Blackrock, Co. Louth"
11338,"€475,000 ","76 Springvale, Edmondstown Road, Rathfarnham, Dublin 16"
11339,"€60,000 ","Carriganurra, Slieverue, Co. Kilkenny"
11340,"€235,000 ","Apartment 31, Block A, Lymewood Mews, Northwood, Santry, Dublin 9"
11341,Price on Application ,"Dooks, Glenbeigh, Co. Kerry"
11342,"€59,950 ","Tornabrattley, Ballyliffin, Co. Donegal"
11343,"€140,000 ","24 Patrick Street, Clara, Co. Kilkenny"
11344,"€360,000 ","Scragg, Carrigatoher, Nenagh, Co. Tipperary"
11345,Price on Application ,"Kiskeam, Kishkeam, Co. Cork"
11346,Price on Application ,"Knochdooragh, Barraduff, Co. Kerry"
11347,"€37,500 ","Lisiniska, Glenaniff, Rossinver, Co. Leitrim"
11348,"€95,000 ","Stralongford, Aghacashel, Co. Leitrim"
11349,"€349,000 ","Tirconail House, Ardgillew, Ballyshannon, Co. Donegal"
11350,"€195,000 ","Corriga, Cross Keys, Co. Cavan"
11351,"€260,000 ","Annalack, Dingle, Co. Kerry"
11352,Price on Application ,"Eallagh, Headford, Co. Galway"
11353,"€620,000 ","9 Tetrarch Grove, Bracetown, Clonee, Co. Meath"
11354,"€280,000 ","2 Lake Court, Kilminchy, Portlaoise, Co. Laois"
11355,"€745,000 ","Ashlorn, Sea Road, Newcastle, Co. Wicklow"
11356,"€1,950,000 ","Shamrock Lodge, Barnhill Avenue, Dalkey, Co. Dublin"
11357,Price on Application ,"Ballinvarrig, Whitechurch, Co. Cork"
11358,"€170,000 ","25 Rooskagh Valley, Shanagarry, Midleton, Co. Cork"
11359,"€275,000 ","51 Mayeston Court, Saint Margaret's Road, Finglas, Dublin 11"
11360,"€325,000 ","2 Aldergrove, Highfield West, Co. Cork"
11361,"€80,000 ","Site For Sale Subject to Planning Permission, Carnmore, Co. Galway"
11362,Price on Application ,"Gortboy, Beaufort, Co. Kerry"
11363,"€149,950 ","26 Ceanann View, Letterkenny, Co. Donegal"
11364,"€140,000 ","1 Gort Na Gréine, Letterkenny, Co. Donegal"
11365,"€110,000 ","Site For Sale Subject to Planning Permission, Carnmore, Co. Galway"
11366,"€55,000 ","Mayne, Kilmeedy, Co. Limerick"
11367,"€330,000 ","Cor Na Ron Middle, Inverin, Co. Galway"
11368,"€100,000 ","Tullig, Whitechurch, Co. Cork"
11369,"€55,000 ","Rathkenny, Abbeydorney, Co. Kerry"
11370,"€260,000 ","8 Faha Glen, Killarney, Co. Kerry"
11371,Price on Application ,"Harbour Road, Kilbeggan, Co. Westmeath"
11372,"€165,000 ","24 Mariners View, Derrymihan West, Castletownbere, Co. Cork"
11373,"€40,000 ","Derrybeg, Co. Donegal"
11374,"€599,000 ","Berry Lodge, Murrisknabol, Westport, Co. Mayo"
11375,"€285,000 ","7 Achill House, Custom House Square, IFSC, Dublin 1"
11376,"€375,000 ","Apartment 48, Block C, The Moorings, Dublin 4"
11377,"€645,000 ","3 The Laurel, Hazeldene Anglesea Road Ballsbridge Dublin 4, Ballsbridge, Dublin 4"
11378,"€235,000 ","Hegarty's Cottage, Ballyspillane, Midleton, Co. Cork"
11379,"€50,000 ","Ballylawn, Moville, Co. Donegal"
11380,"€26,000 ","Logboy, Brickeens, Co. Mayo"
11381,"€40,000 ","Hillbrook, Tinahely, Co. Wicklow"
11382,"€329,000 ","5 Griffeen Glen View, Lucan, Co. Dublin"
11383,"€220,000 ","Apartment 11, Liffey View Apartments, Leixlip, Co. Kildare"
11384,"€545,000 ","Springdale, Ballindooley, Headford Road, Co. Galway"
11385,"€60,000 ","Rahara, Rahara, Co. Roscommon"
11386,"€40,000 ","Meenaclady, Gortahork, Co. Donegal"
11387,"€140,000 ","18 Abbey Vale, Ballyhaunis, Co. Mayo"
11388,"€85,000 ","Site At Barrystown (Subject To P.P), Wellingtonbridge, Bannow, Wellington Bridge, Co. Wexford"
11389,Price on Application ,"Woodfield, Newcastle West, Co. Limerick"
11390,"€290,000 ","Saint Mary's Road, Edenderry, Co. Offaly"
11391,"€625,000 ","50 Crawford Avenue Glasnevin Dublin 9, Glasnevin, Dublin 9"
11392,"€65,000 ","Kilmihill, Ballingarry, Co. Limerick"
11393,"€65,000 ","Dromard, Rathkeale, Co. Limerick"
11394,Price on Application ,"Woodfield, Newcastle West, Co. Limerick"
11395,"€210,000 ","Bawnard, Gneeveguilla, Killarney, Co. Kerry"
11396,"€205,000 ","34 Ballyhooly Road, Dillons Cross, Co. Cork"
11397,"€235,000 ","1 Arduain, Greenville Lane, Enniscorthy, Co. Wexford"
11398,"€390,000 ","Sacre Coeur, Clancy Strand, Co. Limerick"
11399,"€120,000 ","St. Brigid's Road, Portumna, Co. Galway"
11400,"€210,000 ","15 Lee View Place, Monkstown, Co. Cork"
11401,"€385,000 ","129 Kilmore Road, Artane, Artane, Dublin 5"
11402,"€375,000 ","20 Ardbeg Road, Artane, Artane, Dublin 5"
11403,"€35,000 ","Knocknadiha, Tournafulla, Co. Limerick"
11404,"€395,000 ","20 Grattan Parade, Drumcondra, Drumcondra, Dublin 3"
11405,"€50,000 ","Upper Main St, Castlerea, Co. Roscommon"
11406,"€100,000 ","Carrowphadden, Lecarrow, Co. Roscommon"
11407,"€60,000 ","Laharan, Glanworth, Fermoy, Co. Cork"
11408,"€120,000 ","Main Street, Killadysert, Co. Clare"
11409,"€335,000 ","6 Charleston Court, Bailick Road, Midleton, Co. Cork"
11410,"€325,000 ","39 Binn Bhan, Cappagh Road, Knocknacarra, Co. Galway"
11411,"€925,000 ","Silina, 5 Bissetts Strand, Malahide, Co. Dublin"
11412,"€150,000 ","The Village, Newtowncashel, Co. Longford"
11413,Price on Application ,"Enniscouch, Rathkeale, Co. Limerick"
11414,"€160,000 ","Apartment 127, Block 7, Dooradoyle, Co. Limerick"
11415,"€180,000 ","Apartment 3, Ash, Cois Locha, Castlebar, Co. Mayo"
11416,"€180,000 ","2 Kileely Villas, New Road, Thomondgate, Co. Limerick"
11417,"€135,000 ","Aghadiffin, Kilkelly, Co. Mayo"
11418,"€210,000 ","138 Racecourse Meadows, Racecourse Road, Dundalk, Co. Louth"
11419,"€450,000 ","Rathmore, Cahir, Co. Tipperary"
11420,"€185,000 ","51 Crann Ard, Clonmel E91 N8C5, Clonmel, Co. Tipperary"
11421,"€255,000 ","51 The Steeples, Chapelizod, Chapelizod, Dublin 20"
11422,"€65,000 ","3 The Oat Gallery, Bridge Street, Ballinasloe, Co. Galway"
11423,"€399,950 ","9 The Briars, Woodfarm Acres, Palmerstown, Dublin 20"
