,price,address
3884,"€320,000 ","Apartment 12, The Strand, 149 North Strand Road, North Strand, Dublin 3"
3885,"€625,000 ","Sea Haven, Rockmount, Liscannor, Co. Clare"
3886,"€245,000 ","23 O'Neill Street, Carrickmacross, Co. Monaghan"
3887,"€130,000 ","Site fairybush cross subject to planning, Dunmore East, Co. Waterford"
3888,"€230,000 ","20 Carraig Geal, Loughrea, Co. Galway"
3889,"€274,950 ","37 Ashfield Grove, Mulhuddart, Clonsilla, Dublin 15"
3890,"€349,950 ","8 Southern Cross Avenue, Inchicore, Inchicore, Dublin 8"
3891,"€225,000 ","Apartment 52, Temple Place, Dublin 1"
3892,"€274,950 ","17 Ashfield Grove, Mulhuddart, Clonsilla, Dublin 15"
3893,"AMV: €280,000 ","62 Kilmore Road, Artane, Artane, Dublin 5"
3894,"€550,000 ","5 Silver Glen, Gormanstown Road, Stamullen, Co. Meath"
3895,"€230,000 ","The Old Barracks, Doona, Milford, Co. Cork"
3896,"€265,000 ","10 Togher Grove, Monasterevin, Co. Kildare"
3897,"€385,000 ","42 Avoca Drive, Bray, Co. Wicklow"
3898,"€650,000 ","Lateeve More, Ballyferriter, Co. Kerry"
3899,"€229,000 ","30 Quay Village, The Quay, Westport, Co. Mayo"
3900,"€180,000 ","45 Carleton Village, Youghal, Co. Cork"
3901,"€285,000 ","32 Greenpark, Ballymahon Road, Mullingar, Co. Westmeath"
3902,"€375,000 ","343 Boireann Bheag, Roscam, Co. Galway"
3903,"€245,000 ","13 Castlekeep House, Lyreen Manor, Maynooth, Co. Kildare"
3904,"€225,000 ","106 Seven Oaks, Block D, Sarsfield Road, Inchicore, Dublin 8"
3905,"€190,000 ","Dominic Street, Portumna, Co. Galway"
3906,"€630,000 ","1 Marian Drive, Rathfarnham, Dublin 14"
3907,"€435,000 ","11 Rockabill, South Strand, Skerries, Co. Dublin"
3908,"€995,000 ","25 Farney Park, Sandymount, Sandymount, Dublin 4"
3909,"€250,000 ","Dirreencullig, Loo Bridge Clonkeen, Killarney, Co. Kerry"
3910,"€175,000 ","5 Glen Eoin, Manorhamilton, Co. Leitrim"
3911,"€380,000 ","Mill Island, Mallardstown, Kilkenny, Co. Kilkenny"
3912,"€360,000 ",".0000000000000000000000000000000000, Millbrook, Donore, Longwood, Co. Meath"
3913,"€450,000 ","15 Main Street, Kenmare, Co. Kerry"
3914,"€215,000 ","24 Dun Na Manach, Quin, Co. Clare"
3915,"€495,500 ","31 Highland Grove, The Park, Cabinteely, Dublin 18"
3916,"€650,000 ","56 Idrone Park, Knocklyon, Dublin 16"
3917,"€685,000 ","Lissbeg, Station Road, Lusk, Co. Dublin"
3918,"€260,000 ","Land At, Drommcunnig, Abbeydorney, Co. Kerry"
3919,"€375,000 ","2 Greenlands, Sunbury Court, Dartry, Dublin 6"
3920,"€215,000 ","J Walsh, Clogagh, Timoleague, Clonakilty, Co. Cork"
3921,"€405,000 ","50 Mapletoft Close, Prosperous, Co. Kildare"
3922,"€150,000 ","26 Seatown, Dundalk, Co. Louth"
3923,"€415,000 ","3 Hawthorn Manor, Coill Dubh, Co. Kildare"
3924,"€285,000 ","95 Newborough, Gorey, Co. Wexford"
3925,"€325,000 ","111 The Elms, Mount Merrion Avenue, Blackrock, Co. Dublin"
3926,"AMV: €250,000 ","111 St Werburghs, Malahide Road, Swords, Co. Dublin"
3927,"AMV: €170,000 ","37 Glenties Park, Finglas, Dublin 11"
3928,"€230,000 ","Carrig Cluain, Tullamore, Co. Offaly"
3929,"€225,000 ","Trieneragh, Duagh, Co. Kerry"
3930,"€195,000 ","95 Willow Close, Clonmel, Co. Tipperary"
3931,"€290,000 ","Apartment 6, Castlegate Green, Lucan, Co. Dublin"
3932,"€289,000 ","9 The Beeches, Pembroke Wood, Passage West, Co. Cork"
3933,"€159,000 ","364 Glencar Irish, Letterkenny, Co. Donegal"
3934,"€1,300,000 ","4 Carlton, Pembroke Gardens, Ballsbridge, Dublin 4"
3935,"€350,000 ","Murrioch, Ballydavid, Co. Kerry"
3936,"€595,000 ","20 Kill Avenue, Dun Laoghaire, Co. Dublin"
3937,"€220,000 ","37 Clochrán, Kilcloghans, Tuam, Co. Galway"
3938,"€199,000 ","Culmore, Kilkelly, Co. Mayo"
3939,"€182,000 ","Apartment 3, St Catherines, Sienna, Drogheda, Co. Louth"
3940,"€275,000 ","Clooncashel Beg, Kilrooskey, Co. Roscommon"
3941,"€195,000 ","3 Shamrock Hill, Clonmel, Co. Tipperary"
3942,"€180,000 ","Apartment 10, Preston Gate, Athy, Co. Kildare"
3943,"€2,950,000 ","24 Leeson Street Upper, Dublin 4"
3944,"€295,000 ","Genazzano, 58 Slieve Mish Park, Turners Cross, Co. Cork"
3945,"€275,000 ","Rathfredagh, Castlemahon, Newcastle West, Co. Limerick"
3946,"€1,100,000 ","48 Garville Lane, Rathgar, Dublin 6"
3947,"€650,000 ","1 Saint Luke's Crescent, Dundrum, Dublin 14"
3948,"€215,000 ","124 Bryanstown Manor, Dublin Road, Drogheda, Co. Louth"
3949,"€199,000 ","Mullagh, Dromahair, Co. Leitrim"
3950,"€195,000 ","Seanród, Crobally Upper, Tramore, Co. Waterford"
3951,"€280,000 ","42 Kings Hill, Westport, Co. Mayo"
3952,"€180,000 ","Cloghane Village, Cloghane, Co. Kerry"
3953,"€375,000 ","21 Esker Meadow Rise, Lucan, Co. Dublin"
3954,"€250,000 ","Ardmore Road, Mullingar, Co. Westmeath"
3955,"€334,950 ","27 Earlsfort Rise, Lucan, Co. Dublin"
3956,"€250,000 ","Apartment 6, 70 Main Street, Clongriffin, Dublin 13"
3957,"€89,500 ","Derryad, Lanesborough, Co. Longford"
3958,"€245,000 ","Apartment 49, Hampton Square, Cabra, Dublin 7"
3959,"€100,000 ","Corcannon, Inch, Co. Wexford"
3960,"AMV: €110,000 ","36 Castle Green Avenue, Clonmel Road, Cashel, Co. Tipperary"
3961,"AMV: €95,000 ","4 The Railway Cottages, Station Road, Foxford, Co. Mayo"
3962,"€1,250,000 ","4 Harvard Ardilea Clonskeagh Dublin 14, Clonskeagh, Dublin 14"
3963,"€1,200,000 ","Colliga House, Fairyhouse Road, Ratoath, Co. Meath"
3964,"€200,000 ","Balkinstown, Nurney, Co. Kildare"
3965,"€375,000 ","Skeahanagh, Kilbeggan, Co. Westmeath"
3966,"€85,000 ","Moneynaboola, Glen of Aherlow, Co. Tipperary"
3967,"€750,000 ","84 Clonkeen Rd, Deansgrange Clonkeen Road, Blackrock, Co. Dublin"
3968,"AMV: €130,000 ","Fearmore, Mullingar, Co. Westmeath"
3969,"€279,000 ","10 Mary Street, Mullingar, Co. Westmeath"
3970,"€190,000 ","14 Hanover Crescent, Carlow Town, Co. Carlow"
3971,"€245,000 ","Apartment 49, Hampton Square, Navan Road (D7), Dublin 7"
3972,"€360,000 ","Hollymount, Lee Road"
3973,"€219,000 ","Apartment 4, Saint Canice's Square, Church Street, Finglas, Dublin 11"
3974,"€295,000 ","Brooklands, Kilkea, Co. Kildare"
3975,"€295,000 ","Brooklands, Kilkea, Castledermot, Co. Kildare"
3976,Price on Application ,"Derelict Property, Mill Road, Corbally, Co. Limerick"
3977,"€175,000 ","Rockmount, Killadysert, Co. Clare"
3978,"€325,000 ","Apartment 209, Hampton Square, Navan Road (D7), Dublin 7"
3979,"€10,000 ","Cornarona, Inverin, Co. Galway"
3980,"€275,000 ","166 Stannaway Road, Crumlin, Crumlin, Dublin 12"
3981,"€245,000 ","11 The Forge, Lower Main Street, Rush, Co. Dublin"
3982,"€205,000 ","145 Maple Woods, Ballinacurra, Midleton, Co. Cork"
3983,"€250,000 ","Dunmore West, Dunmore, Co. Kilkenny"
3984,"€80,000 ","Two C. 0.75 Acre Sites at Ballinvally Road, Killeigh, Tullamore, Co. Offaly"
3985,"€280,000 ","152 Bremore Castle, Balbriggan, Co. Dublin"
3986,"€495,000 ","99 Glasnevin Avenue, Glasnevin, Dublin 11"
3987,"€395,000 ","Currandrum, Claregalway, Co. Galway"
3988,"€350,000 ","Veronica, Church Road, Douglas, Co. Cork"
3989,"€250,000 ","31 Botanic Road, Ballyphehane, Ballyphehane, Co. Cork"
3990,"€210,000 ","15 Collins Street, Arklow, Co. Wicklow"
3991,"€80,000 ","Vandeleur Street, Kilrush, Co. Clare"
3992,"€475,000 ","69 Maryville Road, Raheny, Dublin 5"
3993,"€50,000 ","Oughtihery, Rylane, Co. Cork"
3994,"AMV: €135,000 ","Apartment 9, Fishermans Quay, Corbally, Co. Limerick"
3995,"€265,000 ","Apartment 21, Danes Court, Clontarf, Dublin 3"
3996,"€300,000 ","16 The Orchard, Crosshaven, Co. Cork"
3997,"€170,000 ","Seascape, 22 A Harbour View, Cobh, Co. Cork"
3998,"€650,000 ","Rosario, 15 Monksfield, Salthill, Co. Galway"
3999,"€247,500 ","54 The Square, Larch Hill, Santry, Dublin 9"
4000,"€149,950 ","175 Ardan View, Tullamore, Co. Offaly"
4001,"€158,000 ","57 Mount Sion Avenue, Co. Waterford"
4002,"€385,000 ","Goretti, 5 Fairy Ville Lawn, The Lough, Co. Cork"
4003,"€325,000 ","The Bungalow, Cahir Road, Cashel, Co. Tipperary"
4004,"€185,000 ","22 Copley Hall, Co. Cork"
4005,"€265,000 ","Apartment 15 The Sycamores, Stradbrook Hill, Blackrock, Co. Dublin"
4006,"AMV: €250,000 ","61 Edgeworth Court, Longwood, Co. Meath"
4007,"€240,000 ","Aughadreena, Rosnakill, Co. Donegal"
4008,"€420,000 ","Rathfilode, Watergrasshill, Co. Cork"
4009,"€499,950 ","1 Willington Grove, Templeogue, Dublin 6W"
4010,"AMV: €125,000 ","Clintstown Road (Folio KK961F), Freshford, Co. Kilkenny"
4011,"AMV: €350,000 ","31 Parklands Square, Celbridge Road, Maynooth, Co. Kildare"
4012,"€349,950 ","Salahoona, Spiddal, Co. Galway"
4013,"€750,000 ","6 Wesley Road Rathgar Dublin 6, Rathgar, Dublin 6"
4014,Price on Application ,"Shanvallybeg, Barley Hill, Westport, Co. Mayo"
4015,"€95,000 ","Coolmore, Knocktopher, Co. Kilkenny"
4016,"€485,000 ","Foxsbridge, Courtbrack, Blarney, Co. Cork"
4017,"€285,000 ","10 Chalwood, Blarney, Co. Cork"
4018,"€235,000 ","Carhooearagh, Listowel, Co. Kerry"
4019,"€350,000 ","Coorycommane, Coomhola, Bantry, Co. Cork"
4020,"€245,000 ","17 Glengarriff Road, Bantry, Co. Cork"
4021,"€365,000 ","9 Dun Na Mara Drive, Renmore, Renmore, Co. Galway"
4022,"€205,000 ","25 Sycamore Drive, Tanyard Wood, Millstreet, Co. Cork"
4023,"AMV: €95,000 ","41 Templegreen, Newcastle West, Co. Limerick"
4024,"€285,000 ","2 Ridgewood Square, Ridgewood, Swords, Co. Dublin"
4025,"€265,000 ","Dromelia, Murroe, Co. Limerick"
4026,"€195,000 ","Railway Cottage, Eastlone, Camus Road, Cashel, Co. Tipperary"
4027,"€195,000 ","Apt 2, 10 Railway Street, Balbriggan, Co. Dublin"
4028,"€575,000 ","7 Ashton Close, Knocklyon, Knocklyon, Dublin 16"
4029,"€199,000 ","2 Paal East, Kanturk, Co. Cork"
4030,"€385,000 ","21 Ard Aoibhinn, Rosslare Strand, Co. Wexford"
4031,"€249,950 ","Baltard, Doonbeg, Co. Clare"
4032,AMV: Price on Application ,"Fearmore, Rochfortbridge, Co. Westmeath"
4033,"€85,000 ","Site Sold SPP, Derrygorman, Westport, Co. Mayo"
4034,"€110,000 ","Apt 1,2,3, Oakview Cottage, Brewery Road, Tralee, Co. Kerry"
4035,"€550,000 ","Saint Jude, 35 Lennox Street, Dublin 8"
4036,"€239,500 ","64 Ashfield, Blackbog Road, Carlow R93 P8K1, Carlow Town, Co. Carlow"
4037,"€165,000 ","51 Maple Close, Avenue Road, Dundalk, Co. Louth"
4038,"€1,000,000 ","Tignabruagh Saintbury Avenue Killiney, Killiney, Co. Dublin"
4039,"€1,250,000 ","4A Bellevue Park, Booterstown, Co. Dublin"
4040,"€440,000 ","89 Woodbrook Lawn, Boghall Road, Bray, Co. Wicklow"
4041,"AMV: €245,000 ","16 & 16A Mount Andrew Rise, Lucan, Co. Dublin"
4042,"AMV: €180,000 ","Gortacur, Mountbolus, Co. Offaly"
4043,"€295,000 ","18 Church Road East Wall Dublin 3, East Wall, Dublin 3"
4044,"€295,000 ","An Tigé­n, Ballindaggan, Co. Wexford"
4045,"€259,000 ","16 Woodford Meadows, Clondalkin, Clondalkin, Dublin 22"
4046,"€139,000 ","76 Hermitage, Ennis, Co. Clare"
4047,"€245,000 ","77 Abbotstown Avenue, Finglas West, Finglas, Dublin 11"
4048,"€345,000 ","69 Marlfield Green, Kiltipper, Tallaght, Dublin 24"
4049,"€190,000 ","32 Saint John's Park, Buncrana, Co. Donegal"
4050,"€230,000 ","Sunberry Cottage, The Hill, Blarney, Co. Cork"
4051,"€150,000 ","Feohanagh, Ballydavid, Co. Kerry"
4052,"€70,000 ","Derrinkip, Fenagh, Co. Leitrim"
4053,"€17,000 ","LD15596F - circa 0.79 acres, Edgeworthstown, Co. Longford"
4054,"€220,000 ","40 Charlotte Grove, Gorey, Co. Wexford"
4055,"€395,000 ","20 Tournville Lodge, Rathfarnham, Dublin 14"
4056,"€375,000 ","103 Retreat Park, Athlone, Co. Westmeath"
4057,"€70,000 ","Durnesh, Rossnowlagh, Co. Donegal"
4058,"€275,000 ","66 Lissadel Drive, Drimnagh, Drimnagh, Dublin 12"
4059,"€5,275,000 ","5,6,7,8 Buckingham St Lower, Dublin 1"
4060,"€375,000 ","6 Hibernia, De Vesci Court, Monkstown, Co. Dublin"
4061,"€360,000 ","153 Shannon House, Custom House Square, IFSC, Co. Dublin"
4062,"€260,000 ","7a St. Johns Wood Court, Ashbourne, Co. Meath"
4063,"€59,500 ","Meenderrynasloe, Annagry, Annagry, Co. Donegal"
4064,Price on Application ,"Eleven Ballyboes, Greencastle, Co. Donegal"
4065,"€330,000 ","1 Woodvale Drive, Clonsilla, Clonsilla, Dublin 15"
4066,"€250,000 ","GILLS BAR, Clare Street, Ballyhaunis, Co. Mayo"
4067,"€850,000 ","60 Dublin Street, Dundalk, Co. Louth"
4068,"€225,000 ","39 Bradóg Way, Gowran, Co. Kilkenny"
4069,"€300,000 ","Feohanagh, Ballydavid, Co. Kerry"
4070,"€325,000 ","Apartment 137, Block 4, Parkgate Place, Islandbridge, Dublin 8"
4071,"€140,000 ","23 Bracklin Park, Edgeworthstown, Co. Longford"
4072,"€1,725,000 ","102 Upr Dorset St, Dublin 1"
4073,"€240,000 ","Cloonaveige, Ennistymon, Co. Clare"
4074,"€259,950 ","6 Ros Mor View, Knocklyon, Dublin 16"
4075,"€725,000 ","28 Glencairn Park, The Gallops, Leopardstown, Dublin 18"
4076,"€35,000 ","Cullane South, Ballylanders, Co. Limerick"
4077,"€1,295,000 ","Clonlea, Knapton Road, Monkstown, Co. Dublin"
4078,"€385,000 ","62 Royston, Kimmage Road West, Kimmage, Dublin 12"
4079,"€995,000 ","26 Buckingham Street Lower, Dublin 1"
4080,"€199,000 ","7 Abbey Terrace, Arklow, Co. Wicklow"
4081,"€125,000 ","63 Carrigeen, Clonmel, Co. Tipperary"
4082,"€95,000 ","43 Lough Fern Heights, Milford, Co. Donegal"
4083,"€90,000 ","13 Lough Fern Heights, Milford, Co. Donegal"
4084,"€60,000 ","Galboystown / Killacroy, Clonmellon, Navan, Co. Meath"
4085,"€199,500 ","7 Woodgrove, Tullow Road, Carlow Town, Co. Carlow"
4086,"€225,000 ","Apartment 26, Stapleton House, Dublin 1"
4087,"€190,000 ","13 An Cluain, Clonmacken, Limerick, Ennis Road, Co. Limerick"
4088,"€285,000 ","41 Charleville Avenue, North Strand, North Strand, Dublin 3"
4089,"€75,000 ","Bealad, Clonakilty, Co. Cork"
4090,"€360,000 ","Ard Na Chuilinn, Hollymount, Lee Road"
4091,"€235,000 ","25 Woodlands Park, Arklow, Co. Wicklow"
4092,"€320,000 ","1 Maple Lane, Castlelake, Carrigtwohill, Co. Cork"
4093,"€190,000 ","113 Thornberry, Letterkenny, Co. Donegal"
4094,"€250,000 ","30 Beechpark, Enniscorthy, Co. Wexford"
4095,"€155,000 ","Warren Lodge, Rossnowlagh, Co. Donegal"
4096,"€395,000 ","12 Drynam Close, Drynam Hall, Kinsealy, Co. Dublin"
4097,"€495,000 ","27 Saint Brendan's Drive, Artane, Artane, Dublin 5"
4098,"€375,000 ","2 Derrynane Hotel Holiday Homes, Glanbeg, Caherdaniel, Co. Kerry"
4099,"€1,695,000 ","Treborth West, 14 Claremont Road, Howth, Co. Dublin"
4100,"€200,000 ","Dunmurraghill, Donadea, Co. Kildare"
4101,"AMV: €115,000 ","7 Lower Grange Terrace, Ballytruckle, Co. Waterford"
4102,"€650,000 ","Lisieux Mews 5 Charlemont Lane Dun Laoghaire, Dun Laoghaire, Co. Dublin"
4103,"€250,000 ","19 The Meadows, Enniscrone, Co. Sligo"
4104,"€375,000 ","5 Derrynane Hotel Holiday Homes, Glanbeg, Derrynane, Co. Kerry"
4105,"€375,000 ","Camblin, New Ross, Co. Wexford"
4106,"€225,000 ","Apartment 52, Trinity Square, Dublin 2"
4107,"€165,000 ","Apartment 2, Sandquay Mills, Clonakilty, Co. Cork"
4108,"€230,000 ","68 Welwyn Road, Maryborough Woods, Douglas, Co. Cork"
4109,"€240,000 ","11 Templemills Cottages, Templemills, Celbridge, Co. Kildare"
4110,"€335,000 ","81 Dunmore Park, Kingswood, Tallaght, Dublin 24"
4111,"€330,000 ","Coranagh, Carrigallen, Co. Leitrim"
4112,"€295,000 ","122 AW Pugin House, Loreto Abbey, Rathfarnham, Dublin 14"
4113,"€245,000 ","25 Baily Point, Salthill, Co. Galway"
4114,"€360,000 ","Fivealley, Carrigatoher, Nenagh, Co. Tipperary"
4115,"€125,000 ","42 The Green, Clonard Village, Clonard, Co. Wexford"
4116,"€425,000 ","5 Library Road, Shankill, Dublin 18"
4117,"€595,000 ","25 Richmond Park, Monkstown, Co. Dublin"
4118,"€1,295,000 ","18 Clonfadda Wood, Mount Merrion Avenue, Blackrock, Co. Dublin"
4119,"€270,000 ","Abbeylands, Ballyshannon, Co. Donegal"
4120,"€385,000 ","Murmod, Virginia, Co. Cavan"
4121,"€100,000 ","Bishopstown, Moate, Co. Westmeath"
4122,"€290,000 ","Main Street , Emly, Co. Tipperary"
4123,"€115,000 ","Apartment 36, Lower Gate, Cashel, Co. Tipperary"
4124,"€200,000 ","11 Cois Bride, Tallow, Co. Waterford"
4125,"€240,000 ","null, Nad, Co. Cork"
4126,"€975,000 ","6 Longwood Avenue, South Circular Road, Portobello, Dublin 8"
4127,"€200,000 ","36 Mill Stream Park, Tuam, Co. Galway"
4128,"€225,000 ","Immal, Churchland, Tinahely, Co. Wicklow"
4129,"€395,000 ","The Nook, Rosemount Lane, Letterkenny, Co. Donegal"
4130,"€725,000 ","17A Belgrove Road, Clontarf, Dublin 3"
4131,Price on Application ,"54 Acres at Derreenauliff, Sneem, Co. Kerry"
4132,"€580,000 ","114 The Elms, Mount Merrion Avenue, Blackrock, Co. Dublin"
4133,"€295,000 ","46 Pinewoods, Clondalkin, Clondalkin, Dublin 22"
4134,"€324,950 ","40 Rathdrum Road, Crumlin, Dublin 12"
4135,"€1,750,000 ","1 Coast Guard Station Apartments, Sky Road, Clifden, Co. Galway"
4136,"€299,000 ","Barntown, Wexford Town, Co. Wexford"
4137,"€1,350,000 ","33 Tritonville Road, Sandymount, Sandymount, Dublin 4"
4138,"€75,000 ","Briskil, Newtownforbes, Co. Longford"
4139,"€145,000 ","Carrowntober West, Kilkerrin, Co. Galway"
4140,"€120,000 ","The Downs, Mullingar, Co. Westmeath"
4141,"€995,000 ","31 Liscahill, Haddon Road, Clontarf, Dublin 3"
4142,"€395,000 ","7 Hampton Court, Bushfield Avenue, Donnybrook, Dublin 4"
4143,"€60,000 ","Tullygullin, Kilcogy, Co. Cavan"
4144,"€389,000 ","3 Oldtown Green, Naas, Co. Kildare"
4145,"€214,950 ","Apartment 70, Mayeston Square, Finglas, Dublin 11"
4146,"€220,000 ","4 Enaville Avenue, North Strand, Dublin 3"
4147,"€195,000 ","19 Geraldine Place, Albert Road, Co. Cork"
4148,"€520,000 ","Rathanrea, 7A Sea Road, Kilcoole, Co. Wicklow"
4149,"€100,000 ","Ballyglass East, Charlestown, Co. Mayo"
4150,"€145,000 ","3 Fox Wood, Gleneely, Co. Donegal"
4151,"€449,950 ","6 Rathborne Walk, Royal Canal Park, Ashtown, Dublin 15"
4152,"€375,000 ","Oakfield Road, Sligo, Co. Sligo"
4153,"€150,000 ","8 Maple Road, Rivercourt, Carlow Town, Co. Carlow"
4154,"€250,000 ","74 Lios An Uisce, Merlin Park, Murroogh, Co. Galway"
4155,"€1,100,000 ","38 Adelaide Road, Dublin 2"
4156,"€199,000 ","Rose Bank, Lamagh, Newtownforbes, Co. Longford"
4157,"€450,000 ","19 Lower John Street, Co. Cork"
4158,"€295,000 ","38 Annagh Court, Waterville, Blanchardstown, Dublin 15"
4159,"€595,000 ","43 Newpark Road, Blackrock, Co. Dublin"
4160,"€205,000 ","15 Wolsey House, Drynam Square, Drynam Hall, Kinsealy, Co. Dublin"
4161,"€299,000 ","20 Clonbeg, Churchill Meadows, Raheen, Co. Limerick"
4162,"€325,000 ","The Rectory, Roscrea Road, Templemore, Co. Tipperary"
4163,"€75,000 ","Ballyfarnoge, Screen, Co. Wexford"
4164,"€45,000 ","Carricknamanna, Killygordon, Co. Donegal"
4165,"€399,000 ","225 The Avenue, Belgard Heights, Tallaght, Dublin 24"
4166,"€150,000 ","THE SALON, Rochfortbridge, Co. Westmeath"
4167,"€250,000 ","Apartment 86, Gandon Hall, Dublin 1"
4168,"€249,000 ","31 The Close, Clonattin Village, Gorey, Co. Wexford"
4169,"€56,000 ","Deelin, Carron, Co. Clare"
4170,"€475,000 ","6 Droim Na Coille Court, Lucan, Co. Dublin"
4171,"€900,000 ","14 Sharavogue, Glenageary Road Upper, Glenageary, Co. Dublin"
4172,"€260,000 ","73 Sundale Avenue, Tallaght, Tallaght, Dublin 24"
4173,"€289,000 ","Gleann, Sooey, Co. Sligo"
4174,"€49,000 ","0.5 Acre Site, Kilmaley, Co. Clare"
4175,"€1,095,000 ","Tara, Kill Lane, Foxrock, Dublin 18"
4176,"€195,000 ","51 Moyglass, Crusheen, Co. Clare"
4177,"€845,000 ","3 Trinity Court, Monaleen Road, Castletroy, Co. Limerick"
4178,"AMV: €95,000 ","8 Yeats Village, Ballinode, Sligo, Co. Sligo"
4179,"AMV: €150,000 ","1 The Orchard, Ropewalk, Monaghan Town, Monaghan, Co. Monaghan"
4180,"€7,250,000 ","Nerano House, Nerano Road, Dalkey, Co. Dublin"
4181,"AMV: €125,000 ","14 Abbey Road, The Steeples, Cashel, Co. Tipperary"
4182,"€245,000 ","Newmarket Road, Kanturk, Co. Cork"
4183,"€225,000 ","10 Glenview, Drogheda, Co. Louth"
4184,"€465,000 ","Oakley Lodge, Lydican, Oranmore, Co. Galway"
4185,"€265,000 ","Roscad, Creeslough, Co. Donegal"
4186,"€295,000 ","20 Oak Way, Clondalkin, Dublin 22"
4187,"€650,000 ","2 Saint Philomena's Road, Glasnevin, Glasnevin, Dublin 11"
4188,"€50,000 ","Clondagh, Tulla, Co. Clare"
4189,"€175,000 ","5 Glen Eoin, Manorhamilton, Co. Leitrim"
4190,"€290,000 ","181 Rath Lodge, Ashbourne, Co. Meath"
4191,"€95,000 ","Falleighter, Kilkelly, Co. Mayo"
4192,"€299,950 ","1 Rockmount Gardens, Carrickmacross Road, Dundalk, Co. Louth"
4193,"€69,000 ","Meenymore, Larkfield Barr, Manorhamilton, Co. Leitrim"
4194,"€165,000 ","Elton, Knocklong, Co. Limerick"
4195,"€198,000 ","11 Woodleigh Way, Blessington, Co. Wicklow"
4196,"€750,000 ","Clair House, Lahinch, Co. Clare"
4197,"€285,000 ","49 Canterbrook, Trim Road, Navan, Co. Meath"
4198,"€275,000 ","10 Carlinn Drive, Mullaharlin Road, Dundalk, Co. Louth"
4199,"€30,000 ","Garranbawn, Murroe, Co. Limerick"
4200,"€85,000 ","Coolreidy, Castleconnell, Co. Limerick"
4201,"€180,000 ","27 Bowman Street, Co. Limerick"
4202,"€185,000 ","Derryhasna, Castleconnell, Co. Limerick"
4203,"€1,300,000 ","66 Haddington, Ballsbridge, Dublin 4"
4204,"€375,000 ","18 The Elms, Newbridge, Co. Kildare"
4205,"€400,000 ","21 The Garnish, Lancaster Gate, Western Road, Co. Cork"
4206,"€415,000 ","485 North Circular Road, Phibsboro, Dublin 7"
4207,"€360,000 ","3 Moreen Road, Sandyford, Dublin 18"
4208,"€125,000 ","Gortmelia Strand, Barnatra, Belmullet, Co. Mayo"
4209,"€365,000 ","Meadow View, Fearavolla, Carbury, Co. Kildare"
4210,"€399,000 ","17 Belmont Square, Raheny, Dublin 5"
4211,Price on Application ,"2 Church View, Askeaton, Co. Limerick"
4212,"€260,000 ","Suncot, Love Lane, Tramore, Co. Waterford"
4213,Price on Application ,"11 Assumpta Park, Newcastle West, Co. Limerick"
4214,"€435,000 ","2 Milltown Houses, Milltown, Dingle, Co. Kerry"
4215,"€430,000 ","Mountain View, Rathmoyle Road, Abbeyleix, Co. Laois"
4216,"€185,000 ","Roy, Doohoma, Doohoma, Co. Mayo"
4217,"€280,000 ","9 The Grove, Kingswood Heights, Tallaght, Dublin 24"
4218,"€445,000 ","473 Pearse Villas, Sallynoggin, Co. Dublin"
4219,"€249,950 ","Baltard, Doonbeg, Kilrush, Co. Clare"
4220,"€210,000 ","Apartment 90, Block D, Westend Gate, Tallaght, Dublin 24"
4221,"€50,000 ","0.20 HA (0.49 Acres)I, Monclink, Manorcunningham, Co. Donegal"
4222,"€315,000 ","42 The Oak, Park View, Belarmine, Stepaside, Dublin 18"
4223,"€179,000 ","Davitt Street, Tullamore, Co. Offaly"
4224,"€525,000 ","Newgrange Lodge, Staleen, Donore, Co. Meath"
4225,"€375,000 ","8 Fairways Park, Bettystown, Co. Meath"
4226,"€175,000 ","305 The Sycamores, Edenderry, Co. Offaly"
4227,"€220,000 ","2 Rathcallan Wood, Ladysbridge, Midleton, Co. Cork"
4228,"€200,000 ","Tivoli, Waterford Road, Tramore, Co. Waterford"
4229,"€50,000 ","Antogher Road, Roscommon Town, Co. Roscommon"
4230,"€89,950 ","Meenbanad, Burtonport, Co. Donegal"
4231,"€75,000 ","Fennor Cross, Garristown, Co. Meath"
4232,"AMV: €50,000 ","Arm, Castlerea, Co. Roscommon"
4233,"€60,000 ","Woodlane, Kildalkey, Co. Meath"
4234,"€525,000 ","47 Grange Park, Rathfarnham, Dublin 14"
4235,"€1,045,000 ","39 Sycamore Road, Mount Merrion, Co. Dublin"
4236,"€685,000 ","64 Ennafort Road, Raheny, Dublin 5"
4237,"€290,000 ","Mount Mary, Ballygar, Co. Galway"
4238,"€299,500 ","1, 2, 3 Monaree, Nenagh, Co. Tipperary"
4239,"€50,000 ","Lisacul, Castlerea, Co. Roscommon"
4240,"€299,500 ","1, 2, 3 Monaree, Nenagh, Co. Tipperary"
4241,"€395,000 ","147 Belgrove Park, Mount Prospect Lawns, Clontarf, Dublin 3"
4242,"€80,000 ","Trillickatemple, Athlone Road, Longford Town, Co. Longford"
4243,"€1,750,000 ","28 Dartmouth Square, Ranelagh, Dublin 6"
4244,"€1,095,000 ","32 Hillcourt Park, Glenageary, Co. Dublin"
4245,"€825,000 ","17 Estate Avenue, Merrion Road, Ballsbridge, Dublin 4"
4246,"€1,300,000 ","1 Eglinton Square, Donnybrook, Dublin 4"
4247,"€340,000 ","4 Brookside, Doughcloyne, Doughcloyne, Co. Cork"
4248,"€875,000 ","Nova House, Sheetland Road, Termonfeckin, Co. Louth"
4249,"€180,000 ","Apartment 510, Block B, Riverpoint, Co. Limerick"
4250,"€860,000 ","16 Cherryfield Avenue Lower, Ranelagh, Ranelagh, Dublin 6"
4251,"€675,000 ","9 Mungret Woods, Mungret, Co. Limerick"
4252,"€145,000 ","26 Mayor's Walk, Co. Waterford"
4253,"€149,000 ","1 Esker Pines, Ballyhaunis, Co. Mayo"
4254,"€165,000 ","14 Whitethorn Close, Letterkenny, Co. Donegal"
4255,"€325,000 ","192 Rath Lodge, Ashbourne, Co. Meath"
4256,"€149,000 ","Apartment 7, Block A, Edenmount Hall, Prospect Drive, Sligo, Co. Sligo"
4257,"€145,000 ","11 Croke Place, Mallow, Co. Cork"
4258,"€350,000 ","Cam, Brideswell, Athlone, Co. Roscommon"
4259,"€895,000 ","123 Home Farm Road, Drumcondra, Drumcondra, Dublin 3"
4260,"€485,000 ","28 Claremont Drive, Glasnevin, Dublin 11"
4261,"€75,000 ","2.03 acres at Baile Eamonn, Spiddal, Spiddal, Co. Galway"
4262,"€260,000 ","76 Hillbrook Woods, Blanchardstown, Blanchardstown, Dublin 15"
4263,"€250,000 ","Apartment 16, Tivoli Woods, Tivoli, Co. Cork"
4264,"€330,000 ","Apartment 28, The Bay, Dublin 4"
4265,"€250,000 ","The Square, Castlepollard, Co. Westmeath"
4266,"€200,000 ","59 Ascal A Dó, Yellowbatter, Drogheda, Co. Louth"
4267,"€675,000 ","7 Lynton Court, Merrion Road, Ballsbridge, Dublin 4"
4268,"AMV: €400,000 ","Fawn, Dromahair, Co. Leitrim"
4269,"€325,000 ","98 An Crannog, Granitefield Manor Rochestown Avenue Dun Laoghaire, Dun Laoghaire, Co. Dublin"
4270,"€180,000 ","Tennalick, Colehill, Co. Longford"
4271,"€299,950 ","81 Alpine Heights, Clondalkin, Clondalkin, Dublin 22"
4272,"€49,000 ","Tennalick, Colehill, Co. Longford"
4273,"€36,000 ","Site - Caltra, Ballinasloe, Co. Galway"
4274,"€595,000 ","Mount Nebo, Gorey, Co. Wexford"
4275,"€465,000 ","Hogmanay, 6 Ardfallen Road, Ballinlough, Co. Cork"
4276,"€480,000 ","113 Bluebell Woods, Oranmore, Oranmore, Co. Galway"
4277,"€299,950 ","119 Saul Road, Crumlin, Dublin 12"
4278,"€40,000 ","Meadstown, Kildorrery, Co. Cork"
